{
  "id": "cv (4390).pdf",
  "normalized_sections": {
    "WORK EXPERIENCE": {
      "raw": "information technology senior manager\nextensive strategic vendor management expertise (vmo leadership) expert in vendor selection process (rfi, rfp, msa and sow)\ninformation technology senior manager\napril 2013 to february 2015 company name city , state\nleading worldwide major manufacturer, distributor and retailer of high quality vitamins & supplements\ninformation technology director\njanuary 2000 to february 2013 company name city , state\nmajor entertainment company providing internet, email, voip and hdtv/vod to 3.2 million customers information technology director:\nresearched, selected, implemented and managed multiple vendor relationships lead several rfi, rfp, mso and sow s.\ndrafted and approved contract amendments/renewals.\ndirectly responsible for managing infrastructure and technical application support teams, improved overall contact center system uptime\nfrom 99.93% to 99.99% through monitoring and proactive maintenance.",
      "companies": [
        "company"
      ],
      "titles": [
        "intern",
        "manager"
      ],
      "years": [
        "20"
      ]
    },
    "PROJECTS": {
      "raw": "and leader in contract negotiations\nco-chairman of change management review board\nsaved millions of dollars in vendor expenses through successfully implemented sourcing partnerships implemented and lead a business relationship management team\naccomplished it technologist with a strong business acumen, including an master of business administration degree\nsuccessfully resolved complex business, technical and operational issues\nspecialist at presenting executive level technical business presentations (vp/svp/cio)\nhighlights\nglobal and strategic sourcing\nvendor selection process\nnegotiations expert\nit technical support\nvendor management\ncloud computing\nmaster of business administration degree\nleadership role in the vendor selection process (rfi/rfp/sow)\nnegotiated and contracted with selected technology vendors to optimize quality and minimize it costs\ndraft, negotiate, and manage large complex vendor contracts\nmeasure vendor performance via scorecards (sla s, performance metrics, system availability)\nimplement and manage multiple successful partnerships with carefully selected key vendors (infosys, accenture, mindtree, presidio,\nsalesforce, oracle (omcs), cisco, genpact, techdemocracy, tata, pegasystems, amdocs, etc.)\nannual recurring savings of 2.75 million dollars from large re-negotiated support agreements.\nimplemented onsite, onshore and offshore talent sourcing models (completed on schedule)\nworked with the business and it teams to successfully implement new technical support vendors/partners.\nmaintained several jd powers top system performance ratings.\ndirected a business relationship management team which was integrated within the business units.\nour it customer surveys improved from c- to b under my lead.\nstrategic vendor management expertise and overall responsibility for system availability (vendor performance metrics, report cards and\nsla s).\nbusiness systems delivery consultant\njanuary 1999 to january 2000 company name city\nclient company (cablevision systems) contract-to-hire and was offered a senior management position within corporate\ninformation technology.\nstarted a new technology support team, centrally supporting over 110 business applications.\nclient services manager\njanuary 1998 to january 1999 company name\nprovided professional consulting services to multiple fortune 500 companies in investments, banking, finance and insurance areas.\nmy customers include merrill lynch, guardian and jp morgan chase.\nimplemented customized crm applications to streamline money transfer reconciliations between world bank members.\nassisted the sales team in closing 3 major new accounts (sales support role).\nsenior management, finance, guardian, information systems, information technology, insurance, investments, itil, itil v, leadership,\nsales support, sla, strategic, technical support, vendor management, voip",
      "keywords": [
        "app",
        "model",
        "system"
      ]
    },
    "EDUCATION": {
      "raw": "m.b.a., masters : business administration adelphi university city , state business administration\nb.s : management and economics state university of new york city , state management and economics",
      "degree": [
        "master"
      ],
      "institution": [
        "university"
      ],
      "years": []
    },
    "SKILLS": [
      "banking",
      "budget",
      "business systems",
      "cisco",
      "client",
      "closing 3",
      "consulting",
      "contracts",
      "crm",
      "customer service",
      "e-business",
      "email",
      "streamline"
    ]
  }
}