{
  "id": "cv (1400).pdf",
  "normalized_sections": {
    "ACHIEVEMENTS": "kirk d. borne\n(updated december 13, 2010)\ndepartment of computational and data sciences\nphone: (703) 993-8402\ncollege of science\nfax: (703) 993-9300\ngeorge mason university\ne-mail: kborne gmu.edu\nms 6a2, fairfax, va 22030\nhttp://classweb.gmu.edu/kborne/\neducational background\n1983\nph.d., astronomy, caltech, pasadena (advisor: james e. gunn)\n1980\nm.s., astronomy, caltech, pasadena\n1975\nb.s., physics, summa cum laude (4.0 gpa), louisiana state university\nacademic honors\n2007\nphi kappa phi faculty mentor award, umuc\n2004 2007\nmultiple student nominations for umuc teaching excellence award\n1998\nraytheon sabbatical research award\n1983 1985\ncarnegie fellowship, carnegie institution of washington\n1978\noutstanding teaching assistance, caltech\n1975 1978\nnational science foundation graduate fellowship, caltech\n1975\nlsu university medal for highest academic honors\n1975\nlsu sigma xi outstanding student of science\n1975\nkeen-morris prize outstanding student of physics\n1972\namerican mathematical society achievement award\n2002\nraytheon service award for science council leadership\n2002\nraytheon service award for outstanding contributions to the\nnasa atmospheric sciences data center program\n1994\nstsci group achievement award for hubble space telescope data\nnasa hubble space telescope guest observer program (hst)\nnasa hubble space telescope archival research program (hst)\nnasa rosat guest investigator program\nnsf astronomy program\nnsf/cise information and data management program (idm)\nnsf/oci datanet program\nnsf/oci cyber-enabled discovery initiative (cdi)\nnsf advances in biological informatics (abi)\nnsf scienti c and software data set visualization program\ndoe exascale co-design program\naas small grants program\naas research experiences for undergraduates program (reu)\nnserc (of canada)\nswedish research council\nfrench agence nationale de la recherche (anr)\neditorships:\nmember of editorial board, isrn astronomy & astrophysics journal\nspecial issue editor, journal of earth science informatics, 2009\nspecial issue editor, journal of applied optics, 2011\n... http://www.opticsinfobase.org/ao/journal/ao/feature announce/pdmfeature.cfm\nother reviews:",
    "PROJECTS": {
      "raw": "archive and distribution system (st-dads) 1991\nnasa goddard space flight center certi cate of recognition for\nservice to hubble space telescope 1989\nstsci individual achievement award for outstanding service to\nprofessional a liations\naas (american astronomical society)\naas dda (division on dynamical astronomy)\nagu (american geophysical union)\nsiam ieee computer society acm sigkdd sigir\nelected memberships\niau (international astronomical union)\nadjunct associate professor, umuc graduate school, database systems\ntechnologies program\n2006 2007\nprogram manager, perot systems corporation (formerly qss group inc.),\nfor the nasa/gsfc space science data operations o ce (ssdoo)\nexploration data services o ce, and the space physics data facility\n2004 2005\nchief scientist, qss group, inc., consultant for nasa s living with a star\n2002 2003\nfounder and space sciences director, institute for science & technology at\nraytheon (ist r)\n1999\nsabbatical visitor, space telescope science institute (stsci)\n1995 2002\nastrophysics department manager, raytheon itss (formerly hughes stx),\nin the nasa/gsfc space science data operations o ce for the adf\n(astrophysics data facility) and the adc (astronomical data center)\n1992 1995\narchive and data distribution system) , stsci (hubble space telescope\nscience institute)\n1992 1995\nscience user interface), stsci\n1990 1995\nassociate scientist, stsci\n1987 1990\nassistant scientist, stsci\n1985 1987\nresearch associate, stsci\n1983 1985\ncarnegie fellow, dtm carnegie institution of washington\n1981 1983\nteaching fellow, dept. of astronomy, university of michigan\n1979 1980\ngraduate research assistant, caltech\n1978 1979\ngraduate teaching assistant, caltech\n1975 1978\nnational science foundation graduate fellow, caltech (one of four nsf\nfellows selected nationwide in astronomy) science team member, nasa s space interferometry mission (sim) dynamical national virtual observatory (nvo) (us-vo.org):\nsenior science personnel (2001-\n2007) international virtual observatory alliance (ivoa.net):\ndata mining group co-principal investigator (gmu),\ngalaxy merger zoo (mergers.galaxyzoo.org) bridge dataworks executive advisory board 106. borne, k. d, providing web access tools for astronomical data and metadata, science\ninformation systems newsletter, 50, 1-3 (1999).\n107. borne, k. d., adc s scienti c users guide and demo page go on-line, science infor-\nmation systems newsletter, vol. 57 (2000).\n108. borne, k., adc scienti c user s guide (2001), archived at\nhttp://web.archive.org/web/20020626230908/adc.gsfc.nasa.gov/adc/adc science/adc-science-guide.html\n11\n109. borne, k. d., arribas, s., bushouse, h., colina, l., & lucas, r., the diverse population\nof ulirgs, in firsed far-infrared and submillimeter spectral energy distributions of\nactive and starburst galaxies, new astronomy reviews (elsevier) (2000)\nhttp://arxiv.org/abs/astro-ph/0009361\n110. colina, l., arribas, s., & borne, k., integral field spectroscopy of ultraluminous infrared\ngalaxies, in asp conference proceedings for imaging the universe in three dimensions,\nscenarios for a vo design reference mission, 195, 220-223 (2000).\n111. borne, k. d., bushouse, h., lucas, r., & colina, l., the ultra-luminous infrared galaxy\npopulation, in asp conference proceedings for gas and galaxy evolution, 240, 202-203\n(2001).\n112. borne, k. d., data mining in astronomical databases, in mining the sky (springer-verlag:\nberlin), 671-673 (2001).\n113. borne, k., & clements, d., the nuclear and extended emission from arp 220, in proceed-\nings for the two years of science with chandra symposium, contributed poster paper 79\n(2001).\n114. borne, k. d., keel, w., appleton, p., struck, c., lucas, r., & schultz, a., hst observations\nof young star clusters in interacting galaxies, in iau symposium 207 proceedings for\nextragalactic star clusters, 474-476 (2002).\n115. shaya, e. j., borne, k., nusser, a., peebles, p. j. e., tonry, j., tully, b., vogel, s., & zaritsky,\nd., space interferometry mission: dynamical observations of galaxies (simdog), in\nscience with the space interferometry mission, 27-29 (2002).\nnssdc s astronomical data center, science information systems newsletter, vol.\n62\n(2002).\n117. shaya, e. j., tully, r. b., peebles, p. j. e., tonry, j. l., borne, k., vogel, s. n., nusser, a., &\nzaritsky, d., space interferometry mission dynamical observations of galaxies (simdog)\n118. borne, k. data mining resources for space science (2003), archived at\nhttp://web.archive.org/web/20050405023752/http://nvo.gsfc.nasa.gov/nvo datamining.html\nscope data (2003), archived at\nhttp://web.archive.org/web/20050410191718/nvo.gsfc.nasa.gov/astrodata/\n120. borne, k. d., arribas, s., bushouse, h., colina, l., & lucas, r., a national virtual obser-\nvatory (nvo) science case: properties of very luminous ir galaxies (vlirgs), in aip\nconference proceedings for the emergence of cosmic structure, 666, 307-310 (2003).\n121. bazell, d., miller, d., & borne, k., novel approaches to semi-supervised and unsupervised\nlearning, in asp conference proceedings for astronomical data analysis software and\nsystems conference (adass) xii, 295, 427-430 (2003).\n12\n122. mcglynn, t., accomazzi, a., berriman, b., borne, k., eichhorn, g., good, j., kimball, t.,\nmazzarella, j., rots, a., & thomas, b., building interoperable nasa archives, in toward\nan international virtual observatory (springer-verlag: berlin), 294-295 (2004).\n123. leisawitz, d., armstrong, t., benford, d., blain, a., borne, k., et al. , probing the invisible\nuniverse: the case for far-ir/submillimeter interferometry, in the proceedings of the\nsecond workshop on new concepts for far-infrared and submillimeter space astronomy,\n167-177 (2004)\n124. borne, k., data mining in distributed databases for interacting galaxies, in asp confer-\nence series for astronomical data analysis software and systems conference (adass) xiv,\n347, 350-354 (2005).\n125. lucas, r., conselice, c., arribas, s., bushouse, h., borne, k., & colina, l., morphological\n146. august 2010 high-end computing - flexible scalable i/o (hec-fsio) data analysis\nchallenge 1: astroinformatics (keynote speaker)\nences collaboration 150. june 2010 astroinformatics-2010 conference (caltech) ubiquitous science: u-science,\n14\n151. may 2010 uc berkeley, joint astronomy-statistics departments seminar the new lsst\ninformatics and statistical sciences research team 152. april 2010 salishan high-performance computing conference scalable peer-to-peer data\nmining for data-intensive astroinformatics 153. march 2010 nasa/gsfc information science & technology colloquium ubiquitous\n154. march 2010 nsf data-enabled science working group (only 2 scientists from each dis-\ncipline were invited to participate) challenges in data-enabled science from petascale\nscience dept seminar data mining research opportunities 180. march 2005 university of maryland at eastern shore (umes) seminar for undergraduate\nmath and computer science majors data mining in action 181. march 2004 university of maryland at eastern shore (umes) grants & proposals presen-\ntation for faculty research opportunities and lessons learned from a lifetime of grant\nwriting 182. march 2004 university of maryland at eastern shore (umes) math & computer sciences\ndept. seminar next generation data mining 183. march 2004 university of maryland at eastern shore (umes) math & computer sciences\ndept. undergraduate data mining course guest lecture data mining in action 184. february 2004 nasa intelligent systems program workshop distributed data mining\ntechniques for object discovery in the national virtual observatory (nvo) 185. january 2004 aas special session for graduate students growing up as a proposer 186. december 2003 umbc computer sciences department distributed data mining in the\n16\n187. november 2003 asme conference, homeland security technologies track (international\nmechanical engineering congress and exhibition) data mining and knowledge discovery\nfor homeland security invited talks at gmu since 2003 (invited by gmu scientists)\n188. april 2010 gmu joint cds-astronomy-statistics departments 009 gmu computational\nstatistics seminar the zooniverse: advancing science through user-guided learning in\nmassive data streams 189. april 2009 guest lecture in gmu cds 101 scienti c data mining: digging for nuggets 190. april 2009 guest lecture in gmu astr 113 the past, present, and future of galaxies 191. november 2007 gmu csi colloquium astroinformatics and petascale mining of large\nastronomy sky survey databases 192. november 2006 gmu ceosr (center for earth observing and space research) 10th\n281. olmedo, o., zhang, j., wechsler, h., poland, a., & borne, k., automatic detection of\ncoronal mass ejections using computer vision (agu, 2006)\n282. borne, k., some epo use cases and data access pathways & portals (lsst, 2006)\n283. borne, k., data-driven discovery through e-science technologies (jpl smc-it, 2006)\n284. olmedo, o., zhang, j., wechsler, h., borne, k., & poland, a. the development of an\nautomatic solar eruptive event detection system (seeds) (aas-spd, 2006)\n21\n286. borne, k., & eastman, t., a paradigm for space science informatics (agu, 2006)\n287. borne, k., automated wild re detection through arti cial neural networks (nasa data\nmining workshop, 2006)\n288. borne, k., discovery informatics for large-database astronomy (interface, 2006)\n289. lucas, r., arribas, s., conselice, c., bushouse, h., borne, k., & colina, l., a sample of\nvlirg morphologies revisited (aas, 2006)\n290. jacoby, s., borne, k., et al. , lsst epo: bringing the changing universe to the public (aas, 2006)\n291. borne, k., using nvo and lsst data in the classroom (aas, 2006)\ncas parameters of some very luminous infrared galaxies (vlirgs) (aas, 2004)\n306. miller, j., borne, k., thomas, b., huang, z., & rilee, m., wild re detection and predic-\ntion (nasa computing, information, & communications technology program, 2003)\n307. dowler, p., shaya, e., thomas, b., borne, k., & huang, z., voql: virtual observatory\nquery language (adass xiii, 2004)\n308. shaya, e., borne, k., & phelps, s., numerical action methods on beowulf clusters (science\ndata centers symposium, 2003)\n309. borne, k., distributed data mining in the national virtual observatory (science data\ncenters symposium, 2003)\n310. borne, k., distributed data mining in the national virtual observatory (spie data min-\ning conference, 2003)\n311. borne, k., the national virtual observatory: scope, issues, challenges, and responses (nasa science data processing workshop, 2002)\n312. mcdowell, j., clements, d., lamb, s., borne, k., et al. , x-rays from arp 220 and its\nsurroundings (aps & aas head, 2002)\n313. borne, k. d., a national virtual observatory (nvo) science case: properties of very\nluminous ir galaxies (vlirgs) (aas, 2002)\ntutorials for hst data at nasa s astronomical data center (adc) (aas, 2002)\n315. borne, k., data mining with the nvo (national virtual observatory (science data centers\nsymposium, 2001)\n316. liu, c., borne, k., stubbs, c., & tyson, j. a., cosmic cinematography with the lssto (aas, 2001)\n317. mcdowell, j., clements, d., lamb, s., arribas, s., borne, k., mundell, c., backer, a., &\ncolina, l., extended x-ray emission in arp 220 (aas, 2001)\n318. shaya, e., borne, k., thomas, b., & cheung, c., publishing scienti c articles in xml (aas, 2001)\n319. borne, k., & cheung, c., science data mining resources for the national virtual observa-\ntory (nvo) (aas, 2001)\n320. borne, k., tools for future observation planning and target selection (nasa science\ndata processing workshop, 2000)\n321. borne, k., using on-line databases to estimate the galaxy interaction rate: looking\nforward to a national virtual observatory (mining the sky conference, 2000)\n322. clements, d., mcdowell, j., shaked, s., baker, a., borne, k., colina, l., lamb, s., &\nmundell, c., chandra observations of arp220: the nuclear source (aas, 2000)\n23\n323. borne, k., patton, d., simard, l., carlberg, r., marske, r., & pritchet, c., hst survey of\ndynamically close galaxy pairs at moderate redshift (aas, 2000)\n324. bushouse, h., borne, k., colina, l., lucas, r., rowan-robinson, m., baker, a., clements,\nd., lawrence, a., & oliver, s., near-ir hst imaging of ultraluminous ir galaxies (aas,\n2000)\n325. shaked, s., mcdowell, j., clements, d., borne, k., lamb, s., baker, a., mundell, c., &\ncolina, l., chandra observations of arp 220 (aas, 2000)\n326. borne, k., & cheung, c., the galaxy interaction and merger rates: a science scenario\nfor a national virtual observatory (nvo) (aas dda, 2000)\n327. borne, k., lucas, r., colina, l., & bushouse, h. the ultra-luminous ir galaxy interaction\nrate (aas dda, 2000)\n328. borne, k., blackwell, j., cheung, c., & leisawitz, d., in search of the ir background using\nlarge astronomical databases (aas, 2000)\n329. holmes, b., gass, j., shaya, e., blackwell, j., thomas, b., schneider, g., odegard, n.,\nborne, k., cheung, c., & sodroski, t., an application of xml: location and retrieval of\npublished data at the adc (aas, 1999)\n330. cheung, c., borne, k., shaya, e., & blackwell, j., using on-line databases to estimate\nthe galaxy interaction rate: looking forward to a national virtual observatory (aas,\n1999)\n331. lucas, r., borne, k., varosi, f., bushouse, h., & colina, l., hst observations of the\nir-ultraluminous qso iras 13349 2438 (aas, 1999)\n332. borne, k., bushouse, h., colina, l., & lucas, r., evidence for multiple mergers among\nultraluminous ir galaxies (aas dda, 1999)\n333. borne, k., white, r. a., cheung, c., & shaya, e., an archival data survey around the\nhubble deep field-south (hdf-s) region (aas dda, 1999)\n334. lucas, r., bushouse, h., colina, l., & borne, k., the archival study of extragalactic tidal\ntails in ngst observations (aas, 1999)\n335. bushouse, h., borne, k., colina, l., & lucas, r., hst reveals the core properties of\nultraluminous ir galaxies (aas, 1998)\n336. white, r. a., borne, k., cheung, c., kargatis, v., leisawitz, d., & shaya, e., an archival\nstudy around the hdf-south region (aas, 1998)\n337. shaya, e., blackwell, j., gass, j., kargatis, v., schneider, g., weiland, j., borne, k., white,\nr. a., & cheung, c., application of xml to journal table archiving (aas, 1998)\n338. borne, k., blackwell, j., gass, j., kargatis, v., schneider, g., shaya, e., weiland, j., cheung,\nc., & white, r. a., new and improved catalog services at the adc (aas, 1998)\n339. kargatis, v., shaya, e., blackwell, j., borne, k., white, r. a., & cheung, c., web-based\ntools for exploration of adc data holdings and nasa data archives (aas, 1998)\n24\n340. shaya, e., kargatis, v., blackwell, j., borne, k., white, r. a., & cheung, c., adf/adc\nweb tools for browsing and visualizing astronomical catalogs and nasa astrophysics\nmission metadata (aas, 1998)\n341. shaya, e., kargatis, v., borne, k., & white, r. a., image perimeters of sky surveys\n(impress): a web tool for visualizing the locations on the sky of nasa missions data (aas, 1997)\n342. borne, k., bushouse, h., colina, l., & lucas, r.a., morphological concordance among\nhdf and ultraluminous ir galaxies, (hubble deep field symposium, 1997)\n343. borne, k., bushouse, h., colina, l., & lucas, r., new results from hst wfpc2 images\nof ultraluminous ir galaxies (aas, 1997)\n344. lucas, r., borne, k., bushouse, h., & colina, l., a hubble space telescope survey of\nultraluminous ir galaxies (aas, 1997)\n345. appleton, p., struck, c., bransford, m., borne, k., & lucas, r., high resolution hst\nimages and vla hi observations of the peculiar empty ring galaxy iizw28 and its newly\ndiscovered companions (aas, 1996)\n346. borne, k., lucas, r., appleton, p., struck, c., schultz, a., & spight, l., hst explores the\nexplosively starbursting cartwheel ring galaxy (aas, 1995)\n347. schultz, a., kochte, m., spight, l., borne, k., disanti, m., rodrigue, m., & colegrove, t., iue spectra of selected ring galaxies (aas, 1995)\n348. borne, k., hst archive status report, in the proceedings for calibrating hubble space\ntelescope - post servicing mission, 386-397 (1995).\n349. borne, k., lucas, r., appleton, p., struck, c., schultz, a., & spight, l., hst imaging\nobservations of the cartwheel ring galaxy (aas, 1994)\n350. borne, k., collisions and mergers among galaxies (aas, 1994)\n351. borne, k., balcells, m., hoessel, j., & mcmaster, m., long-slit kinematic data for a sample\nof interacting ellipticals: searching for u (aas, 1993)\n352. whitmore, b., schweizer, f., leitherer, c., borne, k., & robert, c., hst observations of\nngc 7252 (aas, 1993)\n353. urry, m., borne, k., & walborn, n., hst cycle 2 proposal review (aas, 1991)\n354. borne, k., & scott, j., the density of galaxies around the iras ultraluminous galaxies, in the proceedings of massive stars in starbursts (cambridge university press), p. 5 (1990).\n355. mcglynn, t., & borne, k., angular momentum in tidal interactions (aas, 1989)\n356. borne, k., & colina, l., radio source generation: a study of the strongly-interacting pair\nngc 4782/4783 (aas, 1989)\n357. borne, k., balcells, m., & hoessel, j., investigations of the interacting galaxy pair ngc\n2672/73 (aas, 1987)\n25\n358. borne, k., & balcells, m., a gravitational potential for large n-body calculations (aas,\n1986)\n359. malumuth, e., kriss, g., & borne, k., velocity dispersion pro les of the cd galaxies a2052\nand a2589 (aas, 1985)\n360. borne, k., & hoessel, j., observational signatures of tidal friction in interacting binary\ngalaxies (aas, 1985)\n361. torbett, m., smoluchowski, r., & borne, k., dynamical in uence of molecular cloud en-\ncounters on the oort cloud of comets (aas, 1984)\n362. borne, k., & hoessel, j., ngc 4782 4783: supermassive binary or unbound colliders (aas, 1984)\n363. borne, k., hoessel, j., & schneider, d., dynamics of multiple-nucleus brightest cluster\ngalaxies (aas, 1984)\n364. borne, k., & richstone, d., ngc 7252: a merger scenario (aas, 1982)\n365. borne, k., & hoessel, j., interacting elliptical galaxies: matching models to observations (aas, 1982)\n366. borne, k., merger times in a multiple 3-body simulation of binary galaxies (aas, 1979)\n367. borne, k., spectrophotometric observations of the nova-like variable rw trianguli (aas,\n1977)\npublic outreach talks (selected list since 2000)\n368. the large synoptic survey telescope: mapping the dynamic universe (northern virginia\nastronomy club, april 2011)\n369. stars and galaxies (elementary school, january 2010)\n370. apod: astronomy picture of the day - the good, the very good, and the really cool (public\nlecture, july 2009)\n371. data mining for extra-solar planets: how to get in touch with e.t. (public lecture, july\n2009)\n372. the large synoptic survey telescope: how you can get involved (greenbelt astronomical\nsociety, january 2009)\n373. the new u-science: putting you in the science (public lecture, july 2008)\n374. a wild ride with astronomy (elementary school, january 2008)\n375. science home: the search for e.t., killer asteroids, and the cure for cancer (public\nlecture, july 2007)\n377. dynamic astronomy: everything keeps moving (elementary school, november 2006)\n26\n378. remarkable astronomy (elementary school, november 2006)\n379. a brief history of astronomy leading up to the hubble space telescope (public lecture,\njuly 2005)\n380. digging for nuggets in the national virtual observatory (nvo) (astronomical society of\nharrisburg, march 2005)\n381. the past, present, and future of colliding galaxies (public lecture, july 2004)\n382. the past, present, and future of colliding galaxies alaxies that go bump in the night http://apod.nasa.gov/apod/ap950702.html\n27\nhttp://apod.nasa.gov/apod/ap970223.html\nhttp://apod.nasa.gov/apod/ap970224.html\nhttp://apod.nasa.gov/apod/ap981219.html\nplus many hundreds of other websites in addition to coverage in dozens of news articles,\nmagazines, popular science books, textbooks, and foreign-language books.\n397. ultraluminous infrared galaxies: multiple galaxy collisions surprise hubble astronomers\n(november 22, 1999 nasa press release)\nhttp://hubblesite.org/newscenter/archive/releases/1999/1999/45/results/100/\nplus coverage in many other articles and news outlets, including an exclusive interview with\njapan s nhk-tv, aired in japan.\n398. gmu launches galaxy merger zoo (november 2009) 100 news stories covered the event:\nhttp://aurora.gmu.edu/ jwallin/zoo coverage.html\n399. astronomers put together their wish lists (august 16, 2010 k.borne quoted in usa today\nnews article)\nhttp://www.usatoday.com/tech/science/columnist/vergano/2010-08-15-astronomy-survey n.htm\nentire sky (august 16, 2010 gmu press release)\nhttp://news.gmu.edu/articles/3978\nhttp://www.physorg.com/wire-news/43416511/george-mason-university-partners-with-top-ranked-telescope-proje.html\nhttp://www.hpcwire.com/o thewire/large-synoptic-survey-telescope-gets-top-ranking-105058034.html contributor to assessment of the usefulness and availability of nasa s earth and space\nscience mission data, a report from the space studies board (national academies press,\n2002), http://books.nap.edu/openbook.php record id 10363&page r8 contributed to u.s. gao (government accounting o ce) review of the use of data mining\nsystems in the federal government (2003)\ning to intelligent archive visionary use case: virtual observatories (2003):\nhttp://daac.gsfc.nasa.gov/ida/presentations.shtml\n28\nas an external reviewer and design consultant for the overall lws data environment, including\ndatabase design, architecture, and schema (2004): sgt inc.: databases, space debris tracking, space & earth science\ndata libraries, database design, space & earth science\nment\nmanagement numerous federal agencies (noaa nesdis, nasa, nsa, fda o ce of drug safety,\nnational agricultural library, u.s. library of congress, executive o ce of the pres-\nident, homeland security transition planning o ce): distributed data systems, data\nmining, data management\n29\nsample citation counts (for papers in astronomy journals only tabulated 9/1/2010)\n(excluding all self-citations and does not count non-astronomy refereed papers)\ncitation counts for selected first-author (k.borne) refereed papers\n51\nborne, k. d., apj, 287, 503 (1984).\n15\nborne, k. d., apj, 330, 38 (1988).\n26\nborne, k. d., & hoessel, j. g., apj, 330, 51 (1988).\n19\nborne, k. d., apj, 330, 61 (1988).\n30\nborne, k. d., balcells, m., hoessel, j. g., apj, 333, 567 (1988).\n28\nborne, k. d., & richstone, d. o., apj, 369, 111 (1991).\n11\nborne, k. d., & colina, l., apj, 416, 157 (1993).\n9\nborne, k. d., balcells, m., hoessel, j. g., & mcmaster, m., apj, 435, 79 (1994).\n27\nborne, k. d., et al. ap&ss, 266, 137 (1999).\n9\nborne, k. d., colina, l., bushouse, h., & lucas, r.a., apj, 527, 554 (1999).\n73\nborne, k. d., bushouse, h., lucas, r.a., & colina, l., apjl, 529, l77 (2000).\n294\ntotal\ncitation counts for selected contributing-author refereed papers\n21\nhoessel, j. g., borne, k. d., & schneider, d. p., apj, 293, 94 (1985).\n15\nbalcells, m., borne, k. d., & hoessel, j. g., apj, 336, 655 (1989).\n10\nmcglynn, t. a., & borne, k. d., apj, 372, 31 (1991).\n258\nwhitmore, b. c., et al. aj, 106, 1354 (1993).\n31\nstruck, c., appleton, p.n., borne, k.d., & lucas, r.a., aj, 112, 1868 (1996).\n26\ncolina, l., arribas, s., & borne, k. d., apjl, 527, l13 (1999).\n11\ncolina, l., arribas, s., borne, k. d., & monreal, a., apjl, 533, l9 (2000).\n13\n2010\nmember, nsf data-enabled science working group (only 2 scientists from each\nnsf/mps discipline were selected for this committee)\n2010\n2009\nlead author, 2 position papers submitted to the national academies decadal survey\nof astronomy & astrophysics\n2009\nco-author, 5 position papers submitted to the national academies decadal survey of\nastronomy & astrophysics\npanel chair, xml for science data systems , nasa science data processing work-\nshop, greenbelt, md (sdpw-2002)\n2002\npanel member, data challenges of the future , nasa sdpw-2002\n2001 2008\n2001 2003\nraytheon science council (co-chair in 2002 2003)\n2000 2002\nmember, nasa astrophysics data centers executive council (adec)\n1999 2002\nmember, publications committee of the asp\n1999\ncontributing author, nasa far-ir and submm astronomy working group report charting the winds that change the universe 1999\npanel chairman, extragalactic panel, nasa workshop on submillimeter space as-\ntronomy in the next millennium, greenbelt, md\n1998 2000\ncommittee member (elected), aas division on dynamical astronomy\n1995\nmember, nasa heasarc user group\n1995\ndeputy editor, publications of the asp\n31\n2006\n2006\nco-organizer, aas special session on using data in the classroom\n2003\nexhibits co-chair, kdd-2003, at washington, dc\n2003\nco-lead organizer, raytheon science data centers symposium, at umd\n2001\nlead organizer, raytheon science jamboree, at landover, md\n2000\nco-lead organizer, raytheon science data centers symposium, at jpl,\npasadena, ca\n1998\nlocal organizing committee member, raytheon science data centers sym-\nposium, at noaa, silver spring, md\n1997\nlocal organizing committee member, the ultraviolet universe at low and\nhigh redshift conference, at umd\n1994\nco-organizer, aas conference special session on galaxy dynamics: theory\nand observation\n1992\nco-lead organizer, groups of galaxies conference, at stsci\n1990\nco-lead organizer, the galaxy merger rate conference, at stsci\n1987\nlead organizer, special session on colliding & merging galaxies, aspen\nsummer institute\n33 i feel elevated to be in your data mining class. i haven t seen or come across a professor in my academic\ncareer who taught like you. i appreciate your e orts in that regard. i really enjoyed your class. thank you so much thank you very much. dr. borne. i enjoyed the class and i am going to try looking for a job in data mining. thank you very much for everything. it is really nice to have you as professor for this semester. i have\nlearned so many new and interesting things which can be applied at my work place in future. hope our\npaths will cross sometime in future and i de nitely look forward for that. thank you once again for being\nsuch a wonderful professor. you really worked hard in our class (probably at least three times as hard as most professors), and it was\nde nitely the best class i ve ever taken. i ve taken a lot of courses now at umuc, 11 total, and your data mining course was the best laid out and\nexecuted by far. i enjoyed it very much and if i had to pick an area to consider specializing in, data mining\nlooks really interesting. i d attribute that to your course and your student interaction. thanks again for\nmaking such a great course for us. 36 you have bachelor of engineering a model professor. it has bachelor of engineering a pleasure to be your student. i truly enjoyed the class and can say that i learned the most compared to any other ms class so far. i am\nnot sure when i will get chance to practice data mining, but de nitely this class gave prospective and good\nidea to where to start from, what to expect and what options are available. dr. borne is an excellent professor. he is well-organized, prepared, and provides his students with chal-\nlenging assignments that encourage critical thinking. he is able to convey complex ideas with clarity by\nusing diagrams and examples. just to let you know the response to your lecture on tuesday was overwhelmingly positive. students who\nare not always that interested said it was one of the best things they ve ever heard. one who had to leave\nearly apologized, he wanted to stay and shake your hand. these students saw something relevant in science\nand they ate it up. it has bachelor of engineering extremely fun and interesting to listen to your lectures. i am so happy that i am in your class.\nalso i am so happy that i am in this department and believe i will learn so much and equip myself in many\nways. 37\ngraduate students advised\n1. active gmu students:\nphd advisor for:\npragyansmita nayak\nthomas boggs\nrobert du n\ncristina grieg\ngaphrick jacobs\njohn rigsby\nsteven baehr\narvinder sandhu\ndaniel sponseller\narun vedachalam\ndissertation committee member for:\ngeorgios britzolakis\nmazhalai chellathurai\nlonnie cumberland\nupendra dadi\ndebabrata ghoshal (chair)\ncli ord hall\nallen harvey\nanthony holincheck (chair)\nsukbum hong\nerika jones\nbockhwa kim\noscar olmedo\njohn powell (chair)\nrobert reznik (chair)\nxun wang\n38\n2. past students:\ngmu:\nsandy antunes (phd thesis committee)\nmir mohammed assadullah (phd thesis committee)\nmeixia deng (phd thesis committee)\nrafal ladysz (graduate research advisor)\njuan luna (graduate research advisor)\ngary page (phd thesis committee)\njack scheible (graduate research advisor)\njiang tang (phd thesis committee)\nemmanuel tchanque (graduate research advisor)\nchunguang yu (phd thesis committee)\numbc:\nhaimonti dutta (phd thesis committee)\numbc:\ntushar mahule (ms thesis committee)\numuc:\nbrett baker (phd graduate advisor)\nbowie state u.:\neric wright (summer internship advisor)\nbowie state u.:\nbuni okeke (summer internship advisor)\nbrown university:\nallison chang (summer internship advisor)\nspellman college:\nsimone cooks (summer internship advisor)\nstsci\nmarc balcells (summer internship advisor)\nstsci\nmatt mcmaster (research assistant advisor)\nstsci\njames scott (research assistant advisor)\n39\ngrants history for kirk borne\nnote: k.borne s research was nearly 100% supported by stsci prior to 1995.\n1.\ntitle: computing the galaxy merger rate\nprogram: stsci director s discretionary research fund\npi: k.borne\n14. title: constellation client-server architecture testbed (concat)\nprogram: nasa/gsfc director s discretionary fund\npi: c.cheung\naward: 3/2/00\n15. title: axaf investigation of the archetypal ulirg: arp 220\nprogram: nasa/axaf (chandra x-ray observatory)\npi: dave clements (cardiff)\naward: 7/5/00 12,291\n(k.borne portion)\nprogram: nasa/sim (space interferometry mission) science team\npi: ed shaya (umd)\naward: 11/17/00 1.5m (for full 9-member team for 10-20 years)\n17. title: building the framework of the national virtual observatory (nvo)\nprogram: nsf/itr\npi: alex szalay (jhu)\naward: 10/1/01 329,236 (k.borne total)\n18. title: novel approaches to supervised and unsupervised data exploration\nprogram: nasa/aisrp (applied information systems research program)\npi: david bazell (eureka scientific)\naward: 6/19/02 95,314\n(k.borne portion)\n41\n19. title: distributed data mining in the nvo (national virtual observatory)\nprogram: nasa/isp (intelligent systems program)\npi: k.borne\naward: 12/1/02 204,000 (k.borne total)\n20. title: automatic wildfire detection\nprogram: nasa/isp (intelligent systems program)\npi: jerry miller (nasa)\naward: 12/1/02 140,000 (k.borne portion) items listed below were funded through gmu ............................................................................\n21. title: building the framework of the nvo -- continued\nprogram: nsf/itr\npi: alex szalay (jhu)\nperformance period, total budget: 11/21/03-9/30/06 51,748 (gmu total)\n22. contract title: ssdoo support -- year 1\nprogram: nasa/ssdoo (space science data operations office)\nlead organization: qss group, inc.\naward: 12/1/03-11/30/04 181,090 (gmu total)\n23. title: snapshot survey of the ultraluminous iras galaxy sample (continued)\nprogram: nasa/hst\npi: k.borne (gmu)\nperformance period, total budget: 7/1/04-12/31/05 63,889 (gmu total)\n24. title: machine learning and data mining for automatic detection and\ninterpretation of solar events\nprogram: nasa/aisrp\npi: art poland (gmu)\naward: 10/1/04 80,000\n(gmu total)\n25. title: spitzer imaging and spectroscopy of collisional ring galaxies\nprogram: nasa/spitzer space telescope guest investigator program\npi: phil appleton (caltech)\naward: 6/7/05 0 (gmu total)\n26. contract title: ssdoo support -- continued\nprogram: nasa/ssdoo (space science data operations office)\nlead organization: qss group, inc.\nperformance period, total budget: 12/1/04-11/30/05 83,806 (gmu total)\n27. contract title: lsst community science support\nprogram:\nnsf/lsst\nlead organization: lsst corporation\nperformance period, total budget: 10/1/05-9/30/07 219,830 (gmu total)\n42\n28.\ntitle: developing tools of automatic coronal mass ejection detection\nand characterization\nprogram:\nnasa/lws\npi: jie zhang (gmu)\naward: 7/20/07-7/19/10 254,078 (gmu total)\n29. title: cupids: curriculum for an undergraduate program in data sciences\nprogram:\nnsf/ccli\npi: john wallin (gmu)\naward: 1/01/08-12/31/09 150,000 (gmu total)\n30. title: presence, personalization, and persistence: a new model for doing science\nin a collaborative archive environment\npi: tom mcglynn (nasa)\nprogram:\nnasa/aisr\naward: jan.2008 - dec.2008 35,000 (gmu total)\n31. title: distributed and peer-to-peer data mining for scalable analysis of data\nfrom virtual observatories\npi: hillol kargupta (umbc)\nprogram:\nnasa/aisr\naward: 8/23/07-8/22/10 75,000 (gmu total)\n32. title: virtual astronomy observatory (vao)\npi: ethan schreier (aui)\nprogram:\nnsf",
      "keywords": [
        "analysis",
        "app",
        "model",
        "system",
        "web"
      ]
    },
    "WORK EXPERIENCE": {
      "raw": "isi (international statistical institute) astrostatistics executive board\nmember representative to the lsst (large synoptic survey telescope) board of directors\nphi kappa phi national honor society\nsigma xi international science honor society\nsigma pi sigma national physics honor society\npi mu epsilon national math honor society\n2003 present\nassociate professor of astrophysics and computational science, department\nof computational and data sciences, college of science, gmu (formerly\nschool of computational sciences) (2003 2005, 2008 present)\n2002 2007\n(2000).\n25. colina, l., arribas, s., & borne, k. d., ulirgs: tidal-induced star formation and impli-\ncations for scuba sources , astrophysics & space science, 277, 413 (2001).\n26. farrah, d., rowan-robinson, m., oliver, s., serjeant, s., borne, k., lawrence, a., lucas, r.\na., bushouse, h., & colina, l., hst/wfpc2 imaging of the qdot ultraluminous infrared\ngalaxy sample , monthly notices of the royal astronomical society (mnras), 326, 1333\n(2001).\n5\n27. colina, l., borne, k., bushouse, h., lucas, r., rowan-robinson, m., lawrence, a., clements,\nd., baker, a., & oliver, s., ultraluminous infrared galaxies: mergers of sub-l galaxies ,\nastrophysical journal, 563, 546 (2001).\n28. bushouse, h., borne, k., colina, l., lucas, r., robinson, m., baker, a. c., clements, d.\nl., lawrence, a., & oliver, s., ultraluminous infrared galaxies: atlas of near-infrared\nimages , astrophysical journal supplement series, 138, 1 (2002).\n29. clements, d., mcdowell, j. c., shaked, s., baker, a. c., borne, k., colina, l., lamb, s.\na., & mundell, c., chandra observations of arp 220: the nuclear source , astrophysical\njournal, 581, 974 (2002).\n30. mcdowell, j.c., clements, d. l., lamb, s. a., shaked, s., hearn, n. c., colina, l., mundell,\nc., borne, k., baker, a. c., & arribas, s., chandra observations of extended x-ray emis-\nsion in arp 220 , astrophysical journal, 591, 154 (2003).\n31. keel, w.c, & borne, k.d., massive star clusters in ongoing galaxy interactions: clues to\ncluster formation , astronomical journal, 126, 1257 (2003).\n32. arribas, s., bushouse, h., lucas, r., colina, l., & borne, k., optical imaging of very lu-\nminous infrared galaxy systems: photometric properties and late evolution , astronomical\njournal, 127, 2522 (2004).\n33. eastman, t., borne, k., green, j., grayzeck, e., mcguire, r., & sawyer, d., escience and\narchiving for space science , data science journal, 4, 67 (2005).\n34. patton, d., grant, j., simard, l., pritchet, c., carlberg, r., & borne, k., a hubble\nspace telescope snapshot survey of dynamically close galaxy pairs in the cnoc2 redshift\nsurvey , astronomical journal, 130, 2043 (2005).\n35. giannella, c., dutta, h., borne, k., wol , r., & kargupta, h., distributed data min-\ning for astronomy catalogs, special issue of concurrency and computation: practice and\n36. olmedo, o., zhang, j., wechsler, h., poland, a., & borne, k., automatic detection and\ntracking of coronal mass ejections (cmes) in coronagraph time series, solar physics,\n248, 485 (2008).\n137. december 2010 research data workforce summit, 6th international digital curation con-\nference (chicago, il) data science: an emerging discipline 138. november 2010 middle tennessee state u. program in computational science data-\nenabled science and informatics 139. october 2010 gmu and discovery magazine presents do it yourself: examining the wave\nof non-expert participation in science (k.borne is only scientist on the panel)\n140. october 2010 international conference on extremely large databases (xldb-4) as-\ntroinformatics: at the intersection of machine learning, automated information extraction,\n2006 2007\naas committee on communications (selected by aas president and council)\n2005 2006\ndata products working group, lsst data management team\n2005 2006\n2003 2006\n2002 2006\n10 questions you should ask\nconference panels\n2010\npanel member, educator perspectives panel, research data workforce sum-\nmit, international digital curation conference, chicago, il\n2010\npanel member, do it yourself: examining the wave of non-expert partici-\npation in science , gmu and discovery magazine presentation at 2010 usa\nscience & engineering festival\n2010\npanel member, science perspectives on extremely large databases (inter-\nnational xldb-4 conference)\n2010\npanel member, scienti c and technical data , wolfram data summit\n(www.wolframdatasummit.org)\n2010\npanel member, crowdsourcing and citizen science , astroinformatics-\n2010, caltech\n2010\npanel member, developing the next generation of astroinformatics-\nempowered scientists , astroinformatics-2010, caltech\n2010\npanel member, semantic data mining , astroinformatics-2010, caltech\n2010\npanel member, science applications , salishan high-performance com-\nputing conference\n2010\npanel organizer, aas panel discussion on practical astroinformatics\n2007\n2004\npanel organizer and member, aas grants panel\n2003\npanel member, the increasing role of data mining , federal data mining\ntechnologies conference, washington, dc\n2002\npanel chair, xml for science data systems , nasa science data pro-\ncessing workshop, greenbelt, md\n2002\npanel member, data challenges of the future , nasa science data pro-\ncessing workshop, greenbelt, md\n1999\nchair, extragalactic panel, nasa workshop on submillimeter space as-\ntronomy in the next millennium, greenbelt, md cds accreditation committee (2008) reviewer, gmu provost o ce faculty study leave proposals (2008) gmu scs telescope/observatory committee (2003-2004) prepared and submitted course proposals: cds 151, cds 302, cds 401 prepared and submitted gen ed course proposals: cds 130 (with j.wallin), cds 151\n35\ngmu csi 710 (graduate) scienti c databases: 2003 ,04 ,05,06 ,07 ,08,09,10 co-taught course gmu cds 101 (undergraduate) intro to computational & data sciences: 2010\ngmu cds 302 (undergraduate) scienti c data & databases: 2008\ngmu cds 401 (undergraduate) scienti c data mining: 2008,09\ngmu cds 490 (undergraduate) directed research: 2009\ngmu astro 114 (undergraduate) introduction to modern astronomy ii lab: 2009\ngmu csi 991 (graduate) space sciences seminar: 2004,05 (spring&fall) (3 semesters)\numuc csmn 667 (graduate) data mining: 2003 2005 (spring&fall), 2006 (fall) (7 semesters)\ncourse syllabi created\numuc csmn 667 (graduate): data mining\ngmu csi 710 (graduate): scienti c databases\ngmu astro 401 (undergrad): computer simulation in astronomy\ngmu cds 130 (undergrad): computing for scientists (with j.wallin)\ngmu cds 151 (undergrad): data ethics in an information society\ngmu cds 302 (undergrad): scienti c data and databases\ngmu cds 401 (undergrad): scienti c data mining\nstudent evaluations - how well was this course taught fall 2005\ncsi 710\n4.06 (out of 5)\n(18 evaluations)\nspring 2008\ncds 302\n3.67\n(3)\nfall 2008\ncds 401\n4.33\n(3)\nfall 2008\ncsi 710\n4.46\n(13)\nspring 2009\nastro 114\n4.11\n(18)\ncomments from students on course evaluation forms and from peer evaluation you were one of the best professors i have had in the program. 8\npeer-reviewed public science papers\n8\nedited books\n9\nauthorship on non-reviewed research papers\n9\ninvited talks\n14\nscienti c, technical, & abstracts\n19\npublic outreach talks\n26\npublic information & press releases\n27\nsample citation counts\n30\nprofessional service\n31\nconferences organized & panels served\n33\ngmu service\n35\n36\nstudents advised\n38\ngrants history\n40",
      "companies": [
        "inc",
        "lab",
        "technologies"
      ],
      "titles": [
        "engineer",
        "intern",
        "scientist"
      ],
      "years": [
        "19",
        "20"
      ]
    },
    "EDUCATION": {
      "raw": "aries scienti c board of directors large synoptic survey telescope (lsst) (lsst.org):\ndata products working\nteam, informatics and statistical sciences collaboration team (chair), gmu rep-\nresentative to lsst board of directors\n2\nresearch introduction\nresearch interests dynamics and evolution of galaxies data science, discovery informatics, & astroinformatics scienti c data mining machine learning algorithms for knowledge discovery in large databases correlation, pattern, and outlier discovery in large databases knowledge representation and semantic e-science machine learning for decision support in autonomous science systems computational and numerical simulation research scienti c information systems applied information science research citizen science and human computation research productivity (see following pages) 60 refereed publications. 100 invited talks at universities, agencies, and conferences. 200 additional conference presentations (published papers and abstracts). papers and links to papers are available at http://aurora.gmu.edu/ kborne/\nstatements research statement: http://aurora.gmu.edu/ kborne/gmu-kborne-research2010.pdf teaching statement: http://aurora.gmu.edu/ kborne/gmu-kborne-teaching2010.pdf\n3\npublications and talks\nrefereed journal articles\np. 4\nrefereed conference proceedings\n6\ninvited refereed book chapters\n8\npeer-reviewed public science papers\n8\nedited books\n9\nauthorship on non-reviewed research papers\n9\ninvited talks\n14\nscienti c, technical, & abstracts\n19\npublic outreach talks\n26\npublic information & press releases\n27\n37. borne, k., a machine learning classi cation broker for the lsst transient database , as-\ntronomische nachrichten, 329, 255 (2008).\nof earth science informatics, 3, 5-17 (2010).\nrefereed conference proceedings 39. borne, k., & kimball, t., www access to the hst data archive, vistas in astronomy,\n39, 99 (1995).\n40. borne, k. d., distributed data mining in the national virtual observatory, spie data\nmining and knowledge discovery: theory, tools, and technology v, 5098, 211-218 (2003).\n6\n41. giannella, c., dutta, h., borne, k., wol , r., & kargupta, h., distributed data mining\nfor astronomy catalogs, siam scienti c data mining, online publication1 (2006).\n42. borne, k., data-driven discovery through e-science technologies, ieee international con-\nference on space mission challenges for information technology, 251-256 (2006).\n43. borne, k., & eastman, t., collaborative knowledge-sharing for e-science, aaai work-\nshop on the semantic web for collaborative knowledge acquisition, 104-105 (2006).\n44. j.miller & k.borne, automated wild re detection through arti cial neural networks, in\nremote sensing and modeling applications to wildland fires (springer-verlag and tsinghua\nuniversity press), online publication2 (2007)\n45. dutta, h., giannella, c., borne, k., & kargupta, h., distributed top-k outlier detection\nfrom astronomy catalogs using the demac system, siam scienti c data mining, online\npublication3 (2007).\n46. borne, k. d., a machine learning classi cation broker for petascale mining of large-scale\nastronomy sky survey databases, in next generation of data mining ngdm07, online\npublication4 (2007).\n47. das, k., bhaduri, k., arora, s, gri n, w., borne, k., giannella, c., & kargupta, h., scal-\nable distributed change detection from astronomy data streams using local, asynchronous\neigen monitoring algorithms, siam data mining, 247-258 (2009).\n48. borne, k., wallin, j., & weigel, r., the new undergraduate program in computational\nand data sciences at gmu, lecture notes in computer science, 5545, 74-83 (2009).\n49. dutta, h., zhu, x., mahule, t., kargupta, h., borne, k., et al., taglearner: a p2p clas-\nsi er learning system from collaboratively tagged text documents, ieee international\nconference on data mining - workshop on mining multiple information sources, 495-500\n(2009).\n50. baehr, s., vedachalam, a., borne, k., & sponseller, d., data mining the galaxy zoo\nmergers, nasa conference on intelligent data understanding, online publication5 (2010).\n51. mahule, t., borne, k., dey, s., arora, s., & kargupta, h., padmini: a peer-to-peer dis-\ntributed astronomy data mining system and a case study, nasa conference on intelligent\ndata understanding, online publication5 (2010).\n52. borne, k., & vedachalam, a., e ective outlier detection in science datasets using k-\nnearest neighbor data distributions (knn-dd), nasa conference on intelligent data\nunderstanding, online publication5 (2010). note: as explained at www.cra.org (computing research association), regarding evidence of accomplish-\nment in the eld of computer science, conference publication is preferred6. speci cally, conference publication\n1http://www.siam.org/meetings/sdm06/workproceed/scienti c%20datasets/giannella.pdf\n2http://ntrs.nasa.gov/archive/nasa/casi.ntrs.nasa.gov/20050180456 2005177531.pdf\n3https://www.siam.org/proceedings/datamining/2007/dm07 047dutta.pdf\n4http://citeseerx.ist.psu.edu/viewdoc/summary doi 10.1.1.129.5904\n5https://c3.ndc.nasa.gov/dashlink/resources/220/\n6http://www.cra.org/resources/bp-memos/\n7\nis preferred to journal publication, and the premier conferences are generally more selective than the premier\njournals (academic careers, national academy press, 1994). this tradition is at variance with conventional\nacademic publication traditions. conference publication in the computer science eld is both rigorous and\nprestigious.\ninvited refereed book chapters\n53. borne, k., scienti c data mining in astronomy, in next generation of data mining (taylor\n& francis: crc press), pp. 91-114 (2009). http://arxiv.org/abs/0911.0505\nreach, lsst science book, pp. 87-96, http://www.lsst.org/ les/docs/sciencebook/sb 4.pdf\n(2010).\n55. ferguson, h., et al. (including k. borne), galaxies, lsst science book, pp. 309-344,\nhttp://www.lsst.org/ les/docs/sciencebook/sb 9.pdf (2010).\npeer-reviewed public science papers\n56. rieke, g. h., et al. (including k. borne), charting the winds that change the universe:\nfar infrared and submm astronomy, nasa report (1999).\n57. leisawitz, d., & 124 co-authors (including k.borne), community plan for far-ir/submillimeter\nspace astronomy, http://sa r.gsfc.nasa.gov/docs/community plan printed.pdf (2003).\n58. leisawitz, d., & 28 co-authors (including k.borne), probing the invisible universe: the\ncase for far-ir/submillimeter interferometry, nasa technical report (2004).\nhttp://ntrs.nasa.gov/archive/nasa/casi.ntrs.nasa.gov/20040074288 2004071191.pdf\n59. data-enabled science in the mathematical and physical sciences, report from the nsf\nworking group on data-enabled science to the nsf mps advisory committee (2010) k.borne, signi cant contributing co-author the remaining items listed below (in this category) were submitted to the national academy\nof sciences, as advice to the astro2010 decadal survey of astronomy & astrophysics\n(2009). reports at: http://sites.nationalacademies.org/bpa/bpa 049526\n60. astroinformatics: a 21st century approach to astronomy, (k.borne, primary and lead\nauthor of 91) http://arxiv.org/abs/0909.3892 ranked in top 5 papers from physics during\nthe week it was posted: http://www.technologyreview.com/blog/arxiv/24173 author of 24) http://arxiv.org/abs/0909.3895\n62. educating the next generation of leading scientists: turning ideas into action, (k.borne,\nsigni cant contributing co-author) http://arxiv.org/abs/0903.3327\n63. the astronomical information sciences: a keystone for 21st-century astronomy, (k.borne,\nsigni cant contributing co-author)\n64. science frontiers in galaxy evolution: deep-wide surveys, (k.borne, co-author)\n8\n65. multidimensional image processing and nonlinear dimensionality reduction for advanced\ndata mining and visualization of astronomical images, (k.borne, co-author)\n66. citizen science: status and research directions for the coming decade, (k.borne, signif-\nicant contributing co-author)\n67. advanced data products for the next decade, (k.borne, co-author)\nedited books\n68. groups of galaxies, eds. o.-g. richter & k. borne, asp conference series, volume 70,\n1995 (astronomical society of the paci c: san francisco).\n69. strauss, m., & 200 co-authors (including k.borne), the lsst science book, (2010)\ncas parameters of a sample of very luminous infrared galaxies (vlirgs), in multi-\nwavelength mapping of galaxy formation and evolution (springer-verlag: berlin), 412-413\n(2005).\n126. borne, k., & chang, a., data mining for extra-solar planets, in asp conference series for\nastronomical data analysis software and systems conference (adass) xvi, 376, 453-456\n(2007).\n127. schmitz, m., andernach, h., borde, s., borne, k., et al. , division xii / commission 5 /\nworking group designations in transactions of the iau, volume 3, issue 26b, p. 217 (2007).\n128. appleton, p., gil de paz, a., madore, b., reach, w., struck, c., ..., borne, k., massive\nstar formation and dust in collisional ring galxies: from galex to spitzer, in asp\nproceedings for the second annual spitzer science center conference: infrared diagnostics\nof galaxy evolution, 391, 128-131 (2008).\n129. borne, k., becla, j., davidson, i., szalay, a., & tyson, j. a., the lsst data mining\nresearch agenda , in aip conference proceedings for classi cation and discovery in large\nastronomical surveys, 1082, 347-351 (2008)\n130. ivezic, z., axelrod, t., becker, a., becla, j., borne, k., et al. , parametrization and clas-\nsi cation of 20 billion lsst objects: lessons from sdss , in aip conference proceedings\nfor classi cation and discovery in large astronomical surveys, 1082, 359-365 (2008)\n131. ivezic, z., & the lsst science collaboration, lsst: from science drivers to reference\ndesign and anticipated data products, http://arxiv.org/abs/0805.2366 (2008).\nin asp conference proceedings for epo and a changing world: creating linkages and\nexpanding partnerships, 389, 373-374 (2008).\n133. borne, k., astroinformatics: data-oriented astronomy, in the proceedings for the inter-\nnational conference on computational science (iccs), contributed poster paper 18 (2009).\n134. wallin, j., holincheck, a., borne, k., lintott, c., smith, a., bamford, s., & fortson, l., tasking citizen scientists from galaxy zoo to model galaxy collisions, in asp conference\nproceedings for galaxy wars: stellar populations and star formation in interacting galaxies,\n423, 217-222 (2010).\n13\n135. holincheck, a., wallin, j., borne, k., lintott, c., smith, a., bamford, s., & fortson, l., tasking citizen scientists from galaxy zoo to model galaxy collisions: preliminary results,\ninterface, analysis, in asp conference proceedings for galaxy wars: stellar populations and\nstar formation in interacting galaxies, 423, 223-226 (2010).\n136. jacoby, s., borne, k., prather, e., raddick, m. j., ratclife, d. m., & spuck , t. lsst\nand astronomy 141. september 2010 u.michigan dept of astronomy astroinformatics and the lsst: massive\ndata research in astronomy 142. september 2010 wolfram big data summit (washington dc) astroinformatics: massive\ndata research in astronomy 143. august 2010 harvard computational astrostatistics workshop lsst: informatics and\nstatistics research challenges (keynote speaker)\n144. august 2010 earth and space science informatics 2010 workshop informatics in edu-\n145. august 2010 earth and space science informatics 2010 workshop surprise detection in\nscience data streams 148. july 2010 los alamos national lab (lanl) astroinformatics: data-oriented astronomy\n149. june 2010 astroinformatics-2010 conference (caltech) machine learning from end-user\ndatabase annotations astronomical sky surveys 155. january 2010 aas conference special session on astroinformatics astroinformatics: a\n156. december 2009 agu conference session on semantic e-science x-informatics: practical\nsemantic science - an astronomy implementation 157. october 2009 international conference on next generation data mining the zooniverse:\nadvancing science through user-guided learning in massive data streams 158. august 2009 earth and space science informatics (essi) workshop astroinformatics -\n159. july 2009 rensselaer polytechnic institute dept of web science u-science 160. july 2009 ijcai-09 workshop on machine learning and artificial intelligence applications in astrophysics the vo and large surveys: what more do we need 161. april 2009 us library of congress e-science and data science: preparing for the data\navalanche 162. march 2009 university of vermont computer science dept data science challenges from\npetascale astronomical sky surveys 163. november 2008 university of notre dame joint physics & astronomy - computer science\ndepartments seminar data science challenges from petascale astronomical sky surveys\n- preparing for the data avalanche 164. october 2008 international virtual observatory workshop p2p data mining 165. september 2008 national virtual observatory summer school basic concepts in data\nmining 166. september 2008 national virtual observatory summer school scienti c data mining in\nastronomy 167. june 2008 doe conference on mathematics for analysis of petascale data data science\nchallenges from distributed petascale astronomical sky surveys (keynote speaker)\n168. november 2007 caltech center for advanced computing research (cacr) astroinfor-\nmatics and petascale mining of large astronomy sky survey databases 15\n169. november 2007 university of maryland at eastern shore (umes) data-intensive science:\na new paradigm for research 170. october 2007 nsf symposium on next generation data mining and cyber-enabled dis-\ncovery and innovation a machine learning classi cation broker for petascale mining of\nlarge-scale astronomy sky survey databases 171. april 2007 nasa workshop on science archives for the 21st century lsst: preparing\nfor the data avalanche through partitioning, parallelization, and provenance veys lsst survey data: models for epo interaction 173. july 2006 nasa-gsfc solar system exploration data services o ce (ssedso) sci-\nenti c data mining: digging for nuggets 174. june 2006 nasa-goddard laboratory for solar and space physics (lasp) recent\nadvances in data mining and applications for heliophysics 175. october 2005 johns hopkins university astronomy data, nvo, and lsst: using data\nin the classroom 176. june 2005 nasa-gsfc grid computing workshop grid-enabled science with the\nnational virtual observatory (nvo) 177. may 2005 nasa-goddard space science data operations o ce research in nasas\napplied information systems program (aisrp) 178. april 2005 nasa aisrp pi workshop (nasa-ames research center) distributed data\nmining research in the nasa intelligent systems program 179. march 2005 university of maryland at eastern shore (umes) mathematics & computer\nanniversary workshop computational techniques for astronomical research 193. may 2005 gmu ceosr (center for earth observing and space research) seminar research in nasas applied information systems program (aisrp) 194. april 2005 gmu eastfire conference automated wild re detection and prediction\nthrough arti cial neural networks 195. november 2004 guest lecturer in gmu csi 654 data, data analysis, and information\nsystems in space science 196. september 2004 gmu space sciences seminar the past, present, and future of colliding\ngalaxies 197. march 2004 gmu space sciences seminar science with the national virtual observatory\n(nvo) scope: the origins of this scienti c marvel , astrophysics & analysis of hst images (parts 1 and 2)\n199. may 2003 fda o ce of drug safety scienti c data mining on a cosmic scale 200. april 2003 univ.\nof md eastern shore (umes) math & computer sciences dept. computer science seminar distributed data mining in virtual data systems 201. april 2003 univ.\nof md eastern shore (umes) math & computer sciences dept. undergraduate data mining lecture distributed scienti c data mining 202. march 2003 nasa goddard intelligent systems program seminar distributed data\nmining in the national virtual observatory (nvo) 203. february 2003 conference on data mining technology for military and government ap-\nplications distributed data mining in the national virtual observatory (nvo) 17\n204. november 2002 homeland security transition planning o ce, executive o ce of the\npresident distributed data mining in virtual data systems 205. september 2002 nasa science data processing workshop virtual data systems 206. september 2002 nasa hq, o ce of space sciences distributed data mining in the\nnational virtual observatory (nvo) 207. january 2002 ieee/computer society, baltimore-washington chapter distributed data\nmining in the national virtual observatory 208. december 2001 nasa-goddard friends of information science seminar virtual data\nsystems and the nvo 209. october 2001 nasa-goddard space sciences tech forum science with the national\nvirtual observatory (nvo) 210. october 2001 university of louisiana at lafayette, computer sciences department the\nnational virtual observatory (nvo) 211. october 2001 lsu department of physics and astronomy the national virtual obser-\nvatory (nvo) 212. july 2001 nasa goddard extragalactic astronomy seminar new astrophysics and\ncosmology with the nvo 213. june 2001 u.s. library of congress data mining in the national virtual observatory 214. may 2001 nasa goddard extragalactic astronomy seminar interactive galaxies: some\nassembly required 215. may 2001 gmu school of computational sciences\n216. february 2001 university of alabama, department of astronomy the national virtual\nobservatory (nvo) 217. october 2000 nasa science data processing workshop\n218. 1999 nasa goddard extragalactic astronomy seminar\n219. 1999 nasa it2 committee the digital sky initiative 220. october 1998 university of goettingen, germany\n221. october 1995 university of goettingen, germany\n222. september 1995 naples conference on interacting galaxies, sant agata, italy\n223. may 1994 aas special session honoring alar toomre\n224. january 1994 invited keynote speaker hst observations of interacting galaxies annual meeting of spanish astronomical society, barcelona, spain\n225. june 1992 iowa state university\n226. 1992 university of toronto, canada\n18\n227. february 1991 university of wisconsin\n228. june 1990 aspen workshop on evolution of galaxies\n229. january 1990 university of madrid, spain\n230. june 1987 aspen workshop on dynamics of galaxies\n231. march 1985 space telescope science institute\n232. february 1985 dartmouth university\n233. february 1985 rutgers university\n234. january 1985 university of miami\n235. november 1984 catolica university, santiago, chile\n236. borne, k., & the lsst informatics and statistics team, lsst astroinformatics and as-\ntrostatistics: data-oriented astronomical research (aas, 2011)\n237. ivezic, z., & the lsst science working group (including k.borne), lsst observatory and\nscience opportunities (aas, 2011)\noutreach (aas, 2011)\n239. ptak, a., & the lsst galaxies collaboration (including k.borne), galaxy evolution with\nthe lsst (aas, 2011)\n240. borne, k., & vedachalam, a., e ective outlier detection (surprise detection) in science\ndatasets using k-nearest neighbor data distributions (knn-dd) (nasa cidu, 2010)\n241. borne, k., vedachalam, a., baehr, s., & sponseller, d. mining the galaxy zoo database:\nmachine learning applications (nasa cidu, 2010)\n242. borne, k., gmu conference on innovations in teaching and learning, session organizer\nhttp://cte.gmu.edu/events/in10.html (october 2010)\n243. borne, k., citizen science: human computation (salishan high-performance computing\nconference, april 2010)\n244. borne, k., reaching out with eventful astronomy (the eventful universe conference,\ntucson, az, march 2010)\n245. borne, k., astroinformatics for eventful astronomy (the eventful universe conference,\ntucson, az, march 2010)\n246. borne, k., wallin, j., vedachalam, a., baehr, s., holincheck, a., & the zooniverse team, mining the galaxy zoo database: machine learning applications (aas, 2010)\n19\n247. holincheck, a., wallin, j., borne, k., lintott, c., & smith a., building a catalog of dy-\nnamical properties of interacting galaxies in sdss with the aid of citizen scientists (aas,\n2010)\n248. loredo, t., babu, g. j., borne, k., feigelson, e., gray, a. g., the spectrum of lsst data\nanalysis challenges: kiloscale to petascale (aas, 2010)\n249. jacoby, s., axelrod, t., borne, k., fortson, l., olsen, j., raddick, m. j., ratcli e, d. m.,\n250. lotz, j., ferguson, h., armus, l., barrientos, l., bartlett, j., blanton, m., borne, k., et al. , galaxy evolution with lsst (aas, 2010)\n251. borne, k., the zooniverse: advancing science through user-guided learning in massive\ndata streams (agu, 2009)\n252. borne, k., u-science: putting u (you) into the science (agu, 2009)\n253. borne, k., u-science (earth and space science informatics workshop, 2009)\n254. kargupta, h., borne, k., et al. , distributed and peer-to-peer data mining for scalable\nanalysis of data from virtual observatories , (nasa cidu, 2009)\n255. borne, k., astroinformatics: a data-oriented e-science approach to astronomy research\n256. borne, k., the new computational and data sciences (cds) undergraduate program at\ngeorge mason university (iccs, 2009)\n257. borne, k., laher, r., ivezic, z., & hamam, n., petascale object classi cation of the lsst\nevent stream (aas, 2009)\n258. ferguson, h. c., armus, l., borne, k., et al. , the lsst galaxies science collaboration:\nnearby groups and clusters (aas, 2009)\n259. d abrusco, r., barentsen, g., laurino, o., nayak, p., borne, k., & longo, g., probing the\nquasar distribution within the virtual observatory (aas, 2009)\n260. borne, k., scalable scienti c data mining in distributed, peer-to-peer environments (agu, 2008)\n261. olmedo, o., zhang, j., wechsler, h., poland, a., & borne, k., automated detection of\ncmes with soho and stereo coronagraph observations (agu, 2008)\n262. borne, k., the new computational and data sciences (cds) undergraduate program at\n263. borne, k., the lsst data mining research agenda (classi cation & discovery in large\nastronomical surveys, germany, 2008)\n264. borne, k., data science challenges from distributed petabyte astronomical data collec-\ntions: preparing for the data avalanche through persistence, parallelization, and prove-\nnance (ieee workshop on computing with massive and persistent data, 2008)\n20\n265. kargupta, h., borne, k., & giannella, c., distributed and peer-to-peer data mining for\nscalable analysis of data from virtual observatories (nasa aisr pi workshop, 2008)\n266. borne, k., a classi cation broker for petascale sky surveys (practical semantic astron-\nomy, 2008)\n267. borne, k., astronomical data mining (lsst all hands meeting, 2008)\n268. borne, k., lsst galaxies collaboration report: galaxy assembly history from morphology\nin ultra-deep co-added images (lsst all hands meeting, 2008)\n269. borne, k., xldb science requirements: one astronomer s materialized view (xldb\nworkshop, 2008)\n270. borne, k., & olsen, j., robotic telescopes for engaging students in real research experi-\nences (aapt, 2008)\n271. borne, k., astroinformatics: the new escience paradigm for astronomy research and\n272. borne, k., strauss, m., & tyson, j. a., data mining research with the lsst (aas, 2008)\n273. ferguson, h. c., borne, k., et al. , the lsst galaxies science collaboration (aas, 2008)\n274. olsen, j., & borne, k., lsst survey data - models for epo interaction (agu, 2007)\n275. borne, k., astroinformatics: the new escience paradigm for astronomy research and\nonline (asp annual meeting, 2007)\noutreach (hotwiring the transient universe, 2007)\n278. borne, k., lsst survey data - models for epo interactions (aas, 2007)\n279. olmedo, o., zhang, j., wechsler, h., poland, a., & borne, k., the advancement of an\nautomatic solar eruptive event detection system (seeds) to a near real-time system (aas, 2007)\n280. eastman, t., & borne, k., key architecture elements of a great observatory for space\nphysics (agu, 2006)\n292. olmedo, o., zhang, j., wechsler, h., borne, k., & poland, a. solar eruptive event detec-\ntion system (seeds) (aas, 2006)\n293. appleton, p., armus, l., borne, k., et al. , uv and mid-ir observations of collisional ring\ngalaxies (aas, 2006)\n294. sawyer, d., reich, l., & borne, k., developing architectural alternatives and best practices\nin cooperating registry/repositories for application to space science (agu, 2005)\n295. borne, k., lsst data products (lsst data management workshop, 2005)\n296. borne, k., using lsst and nvo data in the classroom: digging for nuggets (data min-\n297. borne, k., & wallin, j., mining large databases for evidence of galaxy mass assembly (aas, 2005)\n298. borne, k., data mining in distributed databases for interacting galaxies (adass, 2004)\n299. borne, k., data mining in distributed databases for interacting galaxies (star formation\nin the cosmos conference, 2004)\n300. borne, k., data mining in distributed databases for interacting galaxies (lsst commu-\nnity access workshop, 2004)\n301. borne, k., distributed data mining for the national virtual observatory (nasa intelligent\ndata understanding workshop, 2004)\n302. borne, k., & miller, j., wild re detection and prediction (nasa intelligent data under-\nstanding workshop, 2004)\n303. borne, k., huang, z., & luna, j. c., data mining large astronomical databases for inter-\nacting galaxies (aas, 2004)\n304. bushouse, h., arribas, s., lucas, r., colina, l., & borne, k., optical imaging of nearby\nvery luminous ir galaxies (aas, 2004)\n22\n305. lucas, r., conselice, c., arribas, s., bushouse, h., borne, k., & colina, l., morphological\n(astronomical society of harrisburg, january 2004)\n383. the solar system and beyond (elementary school, october 2003)\n384. scienti c data mining on a cosmic scale: data mining for fun and pro t (public lecture,\njuly 2003)\n385. science, technology, engineering, and math: your place among the stars (woodlawn\nhigh school science magnet program, annual dinner keynote speaker, june 2003)\n386. astronomy is for stars (take your children to work day, april 2003)\n387. several talks each year at numerous high schools in maryland as a member of the speakers\n388. science-track talk on nvo at science fiction convention (july 2002)\n389. science-track talk on nvo at science fiction convention (july 2001)\n390. scienti c data mining with the national virtual observatory (national capital astronomers,\nmay 2001)\n391. science-track talk on nvo at science fiction convention (december 2000)\npublic information, including press releases as lead author of scienti c discoveries\n392. tidal friction in galaxies (1983 series of radio interviews, produced by the carnegie insti-\ntution of washington)\n393. ngc 4782 4783: supermassive galaxies or unbound colliders (january 1985 aas con-\nference press release)\n394. observational signatures of tidal friction in interacting binary galaxies (june 1985 aas\nconference press release)\n395. hubble looks at the heart of a galaxy collission (may 25, 1993 nasa press release, with\nbrad whitmore)\nhttp://www.nasa.gov/home/hqnews/1993/93-097.txt\n396. the cartwheel ring galaxy: hubble views a starry ring world born in a head-on collision\n(january 10, 1995 nasa press release)\nhttp://hubblesite.org/newscenter/archive/releases/1995/1995/02/results/100/\narribas, s., colina, l., & borne, k. d., apj, 545, 228 (2000).\n56\nfarrah, d., et al. mnras, 326, 1333 (2001).\n36\ncolina, l., borne, k., et al. apj, 563, 546 (2001).\n55\nbushouse, h., borne, k., et al. apjs, 138, 1 (2002).\n37\nclements, d., et al. apj, 581, 974 (2002).\n36\nmcdowell, j.c., et al. apj, 591, 154 (2003).\n15\nkeel, w.c, & borne, k.d., aj, 126, 1257 (2003).\n22\narribas, s., et al. aj, 127, 2522 (2004).\n17\npatton, d., et al. aj, 130, 2043 (2005).\n9\nolmeda, o., et al. solar physics, 248, 485 (2008).\n34\nstrauss, m., et al. the lsst science book, http://arxiv.org/abs/0912.0201 (2010).\n702\ntotal\n1081 grand total citation count for all refereed astronomy papers\n(does not count citations to refereed computer science papers and to non-refereed papers)\n30\nprofessional service (excludes proposal reviews, except for panel chair duties)\n2010 present\nmember, iau astrostatistics working group\n2010 present\nmember, isi (international statistical institute) executive board for astrostatistics\n2010 present\ngmu member representative to the lsst (large synoptic survey telescope) board\nof directors\n2010 present\nlsst outreach advisory board\n2010 present\ngaia science alerts working group\n2009 present\nchairman/coordinator, large synoptic survey telescope (lsst) informatics &\nstatisics science collaboration team (50 members)\n2009 present\neducational advisory panel, deep space adventure gallery, adler planetarium\n2009 present\ninternational virtual observatory alliance, data mining interest group\n2007 present\nnasa science associates group (nsag)\n2005 present\n2001 present\nvice chair, iau working group on publishing\n2000 present\nmember, iau working group on designations\nspeakers bureau\n2004\npanel chair, peer review, nasa/galex guest investigator program\n2003\n2003\nexhibits co-chair, kdd-2003 conference, washington, dc\n2003\npanel member, the increasing role of data mining , federal data mining technolo-\ngies conference, washington, dc\n2002\nreviewer for journals:\nnature\nthe astrophysical journal (apj)\nthe astrophysical journal supplement series (apjs)\nthe astronomical journal (aj)\npublications of the astronomical society of the paci c (pasp)\nmonthly notices of the royal astronomical society (mnras)\nastronomy & astrophysics (a&a)\nnew astronomy\ncomputing in science and engineering (cise)\nspecial issue, ieee icdm issue on climate data mining\njournal of earth science informatics\napplied optics\nreviewer for agency programs:\nnasa applied information systems research program (aisr)\nnasa astrophysics theory program (atp)\nnasa astrophysics data analysis program (adp / adap)\nnasa midex explorer mission program\nnasa galex guest investigator program\nbook reviewer for cambridge university press (2 book proposals reviewed)\nbook reviewer for taylor & francis (crc press) (2 book proposals reviewed)\n32\nconferences & workshops organized\n2012\nscienti c organizing committee, iau general assembly special session on\ndata-intensive astronomy, beijing, china\n2011\nscience program committee, nasa conference on intelligent data under-\nstanding (cidu-2011)\n2011\nscience program committee, statistical challenges in modern astronomy\n(scma v), penn state u.\n2010\nscience program committee and reviewer, ieee icdm workshop on\nknowledge discovery from climate data\n2010\nscience program committee and reviewer, acm sigspatial interna-\ntional workshop on data mining for geoinformatics\n2010\ngmu conference on innovations in teaching & learning, session proposer\nin your classroom\n2010\nscience program committee and reviewer, nasa conference on intelligent\ndata understanding (cidu-2010)\n2010\nscience program committee and reviewer, earth and space science infor-\nmatics workshop (gmu)\n2010\nscience program committee, astroinformatics-2010, caltech, pasadena\n2010\norganizing committee chairperson, practical astroinformatics special ses-\nsion (aas conference)\n2009\nprogram committee and reviewer, ieee icdm workshop on knowledge\ndiscovery from climate data\n2009\nprogram committee and reviewer, earth and space science informatics\nworkshop (umbc)\n2009\nscience organizing committee, practical semantic astronomy (glasgow,\nscotland)\n2007\n2007\n34\ngmu service\n(cos college of science cds dept of computational & data sciences scs school of\ncomputational sciences)\nactive assignments: cds undergraduate coordinator (2010-present) cds committee for academic program review: assessment and accreditation (2010-present)\n(chair) gmu sostc (scholars of studying teaching collaborative) (2010-present) gmu phi kappa phi scholarship committee (2010-present) (chair) gmu sigma xi chapter coordinator (2010-present) gmu phi kappa phi chartering faculty group (2009-present) cds curriculum committee (2008-present) (chair, beginning 2009) cds representative, numerous undergraduate and graduate student open house events (2008-\npresent)\ncompleted assignments: gmu conference on innovations in teaching and learning, session organizer and leader cds graduate coordinator (2009-2010) cos - usa science festival planning committee (2009-2010) cos curricular innovation group (2009-2010) cos committee on professional science masters degree programs (2009) gmu commencement marshal and cos convocation marshal (2009)\naward: 2/22/91 36,100\n(k.borne total)\n2.\ntitle: the internal dynamics of tidally disturbed elliptical galaxies\nprogram: nato european collaboration/travel support\npi: john hoessel (u.wisconsin)\naward: 1991 2,000 (for european collaborator travel)\n3.\ntitle: high-resolution x-ray imaging of colliding radio-jet galaxies\nprogram: nasa/rosat guest investigator program\npi: k.borne\naward: 3/1/92 32,506\n(k.borne total)\n4.\ntitle: shock morphology in star-forming ring galaxies\nprogram: nasa/hst (hubble space telescope) guest observer program\npi: k.borne\naward: 3/1/94 35,292\n(k.borne portion)\n5.\ntitle: snapshot survey of the ultraluminous iras galaxy sample - part 1\nprogram: nasa/hst guest observer program\npi: k.borne\naward: 9/1/96 34,761\n(k.borne total)\n6.\ntitle: archival study of nuclear morphology in interactive galaxies\nprogram: nasa/hst archival research program\npi: k.borne\naward: 4/1/97 53,301\n(k.borne total)\n7.\ntitle: a nir snapshot survey of ultraluminous ir galaxies\nprogram: nasa/hst guest observer program\npi: k.borne\naward: 5/1/98 108,869 (k.borne portion)\n8.\ntitle: multi-wavelength analysis of ultraluminous galaxies\nprogram: raytheon sabbatical research award program\npi: k.borne\n(first-ever recipient of the award)\naward: 2/1/99\n(6 months salary support at 50%)\n9.\ntitle: do massive star clusters form in young and weak galaxy interactions program: nasa/hst guest observer program\npi: william keel (u.alabama)\naward: 4/1/99 13,945\n(k.borne portion)\n40\n10. title: value-added educational tutorials for hst data\npi: k.borne\naward: 4/1/99 9,982\n(k.borne total)\n11. title: snapshot survey of dynamically close galaxy pairs\nprogram: nasa/hst guest observer program\npi: david patton (trent university)\naward: 10/1/99\naward: 2009-2014\nk.borne/gmu: partner institution, funding is tbd.\n33. title: next generation sky surveys: astronomical opportunities\nand computational challenges\npi:\nrobert mann (u. ediburgh)\nprogram:\nuk e-science institute\naward: 2009-2010\nk.borne/gmu: funded visits to the uk e-science institute for 2009-2010.\n34. title: cds 130: computational and data tools for scientists\nco-pis:\njohn wallin and k. borne (gmu)\nprogram:\ngmu college of science pedagogy innovation grant program\naward: 2009-2010\nk.borne:\ncourse release plus stipend\n35. title: cdi-type ii: zooniverse\nconquering the data flood with a\ntransformative partnership between citizen scientists and machines\nco-pis:\njohn wallin and k. borne (gmu)\nprogram:\nnsf/cdi\naward: 1/01/2010-12/31/2013 706,936\n(gmu total)\n43\n36. title:\ntravel support for nasa conference on intelligent data understanding\npi:\nk. borne (gmu)\nprogram:\naas small research grants\naward: 7/09/2010-12/31/2010 5100\n(gmu total)\n37. title:\nlsstc support\npi:\nk. borne (gmu)\nprogram:\naward: 10/01/2010-05/31/2011 20,187\n(gmu total)\napproved step 1 proposals (but corresponding step 2 proposal was unfunded):\no\ntitle: myvoice: my virtual observatory for informal collaborative\nprogram:\nstep 1 proposal approved (2006), recommended to step 2 by peer review panel\no\ntitle: ubiquitous cyberanalytics expedition for transformative\nexascale science\nprogram:\nnsf expeditions\nstep 1 proposal approved (2007), recommended to step 2 by peer review panel\no\ntitle: hypersky: a dynamical data and computation research framework\nprogram:\nnsf cyber-enabled discovery & innovation\nstep 1 proposal approved (2008), recommended to step 2 by peer review panel\no\ntitle: hypersky: a next generation dynamical data system\nprogram:\nnsf cyber-enabled discovery & innovation\nstep 1 proposal approved (2009), recommended to step 2 by peer review panel\npending research proposals (still in review):\no\ntitle:\nsi2-ssi: a framework for time-critical response\nto astrophysical events\nprogram: nsf software infrastructure for sustained innovation -\nscientific software integration\nfunding requested: 589,920\n( gmu s portion requested)",
      "degree": [
        "master",
        "mba"
      ],
      "institution": [
        "college",
        "institute",
        "school",
        "university"
      ],
      "years": [
        "19",
        "20"
      ]
    },
    "ACTIVITIES": "groups and clusters of galaxies interacting and merging galaxies infrared-luminous galaxies sample citation counts\n30\nrefereed journal articles\n1. borne, k. d., interacting binary galaxies. i. a numerical model and preliminary results ,\nastrophysical journal, 287, 503 (1984).\n2. hoessel, j. g., borne, k. d., & schneider, d. p., the dynamics of four multiple nuclei\nbrightest cluster galaxies , astrophysical journal, 293, 94 (1985).\n3. borne, k. d., interacting binary galaxies. ii. matching models to observations , astro-\nphysical journal, 330, 38 (1988).\n4. borne, k. d., & hoessel, j. g., interacting binary galaxies.\niii. observations of ngc\n1587/1588 and ngc 7236/7237 , astrophysical journal, 330, 51 (1988).\n5. borne, k. d., interacting binary galaxies. iv. simulations, masses, and spatial orientations\nfor ngc 1587/88 and ngc 7236/37 , astrophysical journal, 330, 61 (1988).\n6. borne, k. d., balcells, m., hoessel, j. g., interacting binary galaxies. v. ngc 4782/4783\n(3c278): unbound colliders, not a supermassive pair , astrophysical journal, 333, 567\n(1988).\n7. balcells, m., borne, k. d., & hoessel, j. g., interacting binary galaxies. vi. the fast\nencounter of ngc 2672 and ngc 2673 (karachentsev 175, arp 167) , astrophysical journal,\n336, 655 (1989).\n8. balcells, m., borne, k. d., & hoessel, j. g., two high-velocity encounters of elliptical\ngalaxies , astrophysics & space science, 156, 215 (1989).\n9. pence, w. d., oegerle, w., & borne, k. d., a remarkable double ring galaxy in the\ncluster abell 2199 , astronomical journal, 100, 1766 (1990).\n10. borne, k. d., & richstone, d. o., a merger scenario for ngc 7252: a tale of two tails ,\nastrophysical journal, 369, 111 (1991).\n11. mcglynn, t. a., & borne, k. d., angular momentum and stripping in tidal interactions ,\nastrophysical journal, 372, 31 (1991).\n4\n205, 217 (1993).\n13. whitmore, b. c., schweizer, f., leitherer, c., borne, k., & robert, c., hst discovery\nof candidate young globular clusters in the merger remnant ngc 7252 , astronomical\njournal, 106, 1354 (1993).\n14. borne, k. d., & colina, l., ballistic models for radio jets in colliding galaxies: 3c 278\n(ngc 4782/4783) , astrophysical journal, 416, 157 (1993).\n15. borne, k. d., balcells, m., hoessel, j. g., & mcmaster, m., interacting binary galaxies.\nvii. kinematic data for 12 disturbed ellipticals , astrophysical journal, 435, 79 (1994).\n16. colina, l., & borne, k. d., the unusual x-ray collision morphology of ngc 4782/4783\n(3c278) , astrophysical journal, 454, l101 (1995).\n17. struck, c., appleton, p.n., borne, k.d., & lucas, r.a., hubble space telescope imaging\nof dust lanes and cometary structures in the inner disk of the cartwheel ring galaxy ,\nastronomical journal, 112, 1868 (1996).\n18. borne, k. d., bushouse, h., colina, l., lucas, r. a., baker, a., clements, d., lawrence, a.,\noliver, s., & rowan-robinson, m., a morphological classi cation scheme for ulirgs ,\nastrophysics & space science, 266, 137 (1999).\n19. arribas, s., colina, l., & borne, k., two-dimensional optical spectroscopy of ulirg s:\ncomparison with hst imaging , astrophysics & space science, 266, 143 (1999).\n20. borne, k. d., colina, l., bushouse, h., & lucas, r.a., hst observations of the serendip-\nitous x-ray companion to markarian 273: cluster at z 0.46 , astrophysical journal, 527,\n554 (1999).\n21. colina, l., arribas, s., & borne, k. d., integral field spectroscopy of mrk273: mapping\nhigh-velocity gas flows and an o -nucleus sey 2 nebula , astrophysical journal, 527, l13\n(1999).\n22. borne, k. d., bushouse, h., lucas, r.a., & colina, l., evidence for multiple mergers among\nultraluminous infrared galaxies: remnants of compact groups , astrophysical journal,\n529, l77 (2000).\n23. colina, l., arribas, s., borne, k. d., & monreal, a., detection and mapping of decoupled\nstellar and ionized gas structures in the ultraluminous infrared galaxy iras12112 0305 ,\nastrophysical journal, 533, l9 (2000).\n24. arribas, s., colina, l., & borne, k. d., merging process and tidal-induced star formation\nin the ultraluminous infrared galaxy iras 08572 3915 , astrophysical journal, 545, 228\nhttp://arxiv.org/abs/0912.0201\nauthorship on non-reviewed research papers\n70. borne, k. d., the structure and evolution of interacting binary galaxies, ph.d. thesis,\ncalifornia institute of technology (1983).\n71. borne, k. d., the path to a merger, in the galaxies volume of the time/life voyage\nthrough the universe series, 104-105 (1988).\n72. borne, k. d., probing the tides in interacting galaxy pairs, in iau colloquium 124\nproceedings paired and interacting galaxies, 537-542 (1990).\n73. borne, k. d., tidal phenomena in interacting galaxies, in proceedings for dynamics and\ninteractions of galaxies (berlin: springer), 196-199 (1990).\n74. borne, k., & whitmore, b., hubble space telescope phase i proposal instructions, nasa\ntechnical report (1990).\n75. borne, k., hubble space telescope phase i proposal instructions, nasa technical report\n(1991 and 1992).\n76. borne, k. (lead author and coordinator), hubble space telescope cycle 3 call for propos-\nals, nasa technical report (1992).\nthe moriond 1992 conference on physics of nearby galaxies: nature or nurture, 337-350\n(1992).\nconnection, in proceedings for the evolution of galaxies and their environment, 249-250\n(1993).\n79. borne, k. (initial creator and original author), hubble space telescope (hst): the aec\n(archived exposures catalog), (1992 and 1993 which continued to be published annually\nby nasa-hst archive scientists since 1993 to the present day).\nhttp://ntrs.nasa.gov/archive/nasa/casi.ntrs.nasa.gov/19930017234 1993017234.pdf\n80. borne, k., the hubble space telescope archive primer, nasa technical report (1993).\n9\n81. borne, k., the hubble space telescope archive manual, nasa technical report (1994).\n82. borne, k. d., & colina, l., multi-wavelength observations of interactive galaxies, in\n384-385 (1994).\n83. long, k. s., baum, s., borne, k., & swade, d., the hubble space telescope data archive, in asp conference proceedings for astronomical data analysis software and systems con-\nference (adass) iii, 61, 151-154 (1994).\n84. borne, k. d., baum, s., fruchter, a., & long, k., the hubble space telescope data\narchive, in asp conference proceedings for astronomical data analysis software and sys-\ntems conference (adass) iv, 77, 158-161 (1995).\n85. borne, k. d., hst archive status report, in calibrating hubble space telescope: post\nservicing mission, 386-397 (1995).\n86. borne, k., & levison, h., group simulations: looking for compact groups, in asp\nconference proceedings for groups of galaxies, 70, 151-153 (1995).\n87. borne, k. d., hubble space telescope data archive st-dads veri cation report, nasa\ntechnical report (1995).\n88. borne, k. d., lucas, r., appleton, p., struck, c., schultz, a., & spight, l., wfpc2\nimaging of the cartwheel ring galaxy, in science with the hubble space telescope - ii, pp. 239-248 (1996).\nhttp://ntrs.nasa.gov/archive/nasa/casi.ntrs.nasa.gov/19990042108 1999057787.pdf\n90. appleton, p., struck, c., bransford, m., charmandaris, v., marston, a., borne, k., & lucas,\nr., mapping stellar evolution in the wake of density waves in ring galaxies, in iau\nsymposium 171 proceedings for new light on galaxy evolution, 337 (1996).\n91. borne, k., & colina, l., the unusual x-ray collision morphology of ngc 4782/4783 (3c\n278), in the proceedings for the international conference on x-ray astronomy and astro-\nphysics: roentgenstrahlung from the universe, 427-428 (1996).\n92. borne, k., bushouse, h., colina, l., & lucas, r., early results from an hst imaging survey\nof the ultraluminous ir galaxies, in aip conference proceedings for star formation, near\nand far, 393, 295-298 (1997).\n93. borne, k., bushouse, h., colina, l., & lucas, r., an hst imaging survey of the ultralu-\nminous ir galaxies: in search of the power source, in proceedings for the moriond 1997\nconference on extragalactic astronomy in the infrared, 277-282 (1997).\n94. borne, k. d., bushouse, h., colina, l., & lucas, r., morphological similarities between\nhdf and ultraluminous ir galaxies, in aip conference proceedings for the ultraviolet\nuniverse at low and high redshift, 408, 423-428 (1997).\n95. borne, k. d., collision-induced star formation in ring galaxies, in proceedings for\n(1997) judged by conference participants as the best poster at the conference .\n10\n96. borne, k. d., hst observations of the ultraluminous ir galaxies, in proceedings for\n(1997).\n(1997).\n98. bushouse, h., colina, l., lucas, r., & borne, k., simulations of ngst observations of\nultraluminous ir galaxies, in asp conference proceedings for science with the next gen-\neration space telescope (ngst), 233-236 (1998).\n99. borne, k. d., bushouse, h., colina, l., & lucas, r., early results from an hst imaging\nsurvey of the ultraluminous ir galaxies, in iau symposium 179 proceedings for new\nhorizons from multi-wavelength sky surveys, 275-277 (1998).\n100. kargatis, v., shaya, e., blackwell, j., borne, k., white, r. a., & cheung, c., web-based\ntools for exploration of adc data holdings and nasa data archives in asp conference\nproceedings for astronomical data analysis software and systems conference (adass) viii,\n172, 217-220 (1999).\n101. shaya, e., blackwell, j., gass, j., kargatis, v., schneider, g., borne, k., cheung, c., &\nwhite, r. a., formatting journal tables in xml at the adc, in asp conference pro-\nceedings for astronomical data analysis software and systems conference (adass) viii,\n172, 274-277 (1999).\n102. borne, k., bushouse, h., colina, l., lucas, r., baker, a., clements, d., lawrence, a., oliver,\ns., & rowan-robinson, m., nicmos and wfpc2 imaging of ultraluminous galaxies, in\nasp conference proceedings for astrophysics with infrared surveys: a prelude to sirtf,\n177, 167-170 (1999).\n103. borne, k. d., bushouse, h., colina, l., & lucas, r., dynamics of ultraluminous galaxies, in asp conference proceedings for galaxy dynamics, 182, 461-462 (1999).\n104. borne, k. d., bushouse, h., colina, l., & lucas, r., evidence for multiple mergers among\nultraluminous ir galaxies, in aip conference proceedings for after the dark ages, when\ngalaxies were young, 470, 220-224 (1999).\n105. borne, k. d., shaya, e., white, r. a., & cheung, c., an archival survey of the hdf-\nsouth, in aip conference proceedings for after the dark ages, when galaxies were young,\n470, 438-442 (1999).\n401. gmu and discover magazine present citizen science: tapping the wisdom of crowds k.borne was one of four nationally selected panelists, and the only scientist on the panel\n(october 14, 2010)\nhttp://www.sciencecheerleader.com/2010/10/tapping-the-wisdom-of-crowds-1014-george-mason-univ/ 1987-1992: chief software & database architect for the hubble space telescope peer review\nproposal selection and tac (telescope allocation committee) support system 1990-1993: organizer and host for the hubble space telescope science institute galaxies\njournal club 2004-2005: organizer and host for the gmu space sciences seminar\nhttp://lwsde.gsfc.nasa.gov/dewg ws poster v05.pdf contributed to the nasa sun-earth connection data centers working group charter and vice president, aries scienti c inc. (non-pro t): http://www.aries-scienti c.org/ 55,985\n(k.borne total)\n12. title: multi-band imaging of a moderate-reshift abell cluster of galaxies\nprogram: nasa/hst leonid service observing program\npi: k.borne\n(only proposal selected from over 20 submitted)\naward: 10/21/99\n(award was not issued due to program cancellation by nasa)\namong ultraluminous starbursts\nprogram: nasa/atp (astrophysics theory program)\npi: k.borne\naward: 3/1/00 104,026 (k.borne portion)",
    "ABOUT": "science systems consultant: http://www.consultssc.com/pages/742223/ blog: http://dataineducation.blogspot.com/\nperiod of performance:\n10/1/2010-9/30/2013\no\ntitle:\nbig history\nprogram:\nbill and melinda gates foundation\nco-pi s:\nlou mayo (aries), kirk borne (gmu), tim eastman (aries)\nfunding requested: 10m\n(gmu s portion requested tbd)\nperiod of performance:\n1/1/2011-12/31/2015\n44\no\ntitle:\nrnms: statistics and informatics for astronomical surveys\nprogram:\nnsf research networks in the mathematical sciences\npi:\njogesh babu (penn st.)\nfunding requested: 5m\n(gmu s portion requested tbd)\nperiod of performance:\n6/1/2011-5/31/2016\nprior to gmu :\n20 grants 1,342,500\nfunded at gmu :\n17 grants 1,929,664\ngrand total :\n37 grants 3,272,164\n45\nvitae kirk borne\ntable of contents\nacademic, professional, and employment background\n1\nresearch introduction\n3\npublications and talks\n4\nrefereed journal articles\n4\nrefereed conference proceedings\n6\ninvited refereed book chapters"
  }
}