{
  "id": "cv (4411).pdf",
  "normalized_sections": {
    "ABOUT": "executive director\nvisionary executive director who excels at marketing communication with demonstrated ability in the development of results-driven, strategic,\nrepresents the center to the community and serves as the primary spokesperson and chief liaison with local media.\nsee http://www.foothillscac.org/news-events.html for examples of press releases and media coverage. other major responsibilities\nadministrative\nleadership reports directly to and works with the board of directors to ensure the sustainability and growth of the 501(c)3\norganization oversees a staff of two full-time and two part-time persons.\nstrategic planning works with the board of directors to develop the center s strategic plan, policies, and procedures is",
    "SKILLS": [
      "accountant",
      "accounting",
      "advertising",
      "and marketing",
      "basis",
      "customer service",
      "fundraising",
      "gaap",
      "internal communications",
      "its",
      "maintenance",
      "marketing",
      "marketing research",
      "print advertising",
      "print campaign",
      "public relations",
      "receptionist",
      "retail sales",
      "strategic planning",
      "teaching"
    ],
    "PROJECTS": {
      "raw": "marketing\npublic relations\nbudgeting expertise\nprint, broadcast, web, and social media communication\nself-motivated\nevent planning, million, recruiting, branding, budgets, community outreach, financial statements, general ledger, leads, media relations,\nprocurement, recruitment, acrobat, adobe indesign, ap, ar, biomedical, civil site, conflict management, content management, content\nmanagement systems, database, database management, excel, human resources, indesign, jam, leadership development, learning and\ndevelopment, mac, mentoring, microsoft word, nas, network attached storage, networking, od, optimization, organizational development,\nphotoshop, pipeline, powerpoint, quota, site design, statistics, time management, training, training programs, word",
      "keywords": [
        "system",
        "web"
      ]
    },
    "WORK EXPERIENCE": {
      "raw": "core accomplishments\nmanaging editor, academic varsity: an informal history of the morningside college interdepartmental honors program 2002,\nmorningside college press\nkeynote speaker, quota international of sioux city annual eighth grade honors luncheon, march 2006 and march 2007\nexecutive director\nmay 2013 to current company name city , state\nresponsibilities related to writer/editor position chief writer/editor\nresponsible for writing/editing content for all organizational publications, including the development and production of all public relations\nmaterials, the web sites (www.foothillscac.org, beaheroforkids.org, wordshurttoo.org), newsletters, publications, and educational materials.\nresponsible for the implementation of the same.\nfiscal & facility management is responsible for ensuring that sound fiscal practices in line with generally accepted\naccounting principles (gaap) and 501(c)3 regulations are followed administers the center s programs within budgetary provision provides comprehensive grant management and works with staff to ensure that all financial and program reports to funders are timely and\naccurate and oversees the maintenance of the facility and procurement of equipment.\nevaluation of staff and volunteers and ensures that job descriptions are developed, regular performance evaluations are held, and sound\nhuman resource practices are in place. program oversight & support\nprogram supervision supports the program staff as needed and ensures that all programs are operating appropriately and are in\nalignment with the vision, mission, and goals of the center.\nprogram development working with the board, maintains the shared vision of the organization and appropriate goals and\nstrategies to achieve that mission, provides leadership in developing programs and organizational and financial plans, maintains acceptable\nstandards of professional practice in the center, and ensures ongoing accreditation by the national children s alliance.\nprogram evaluation is responsible for evaluation of programs and overall evaluation of the center, including ensuring the\nappropriate and accurate collection of data and analysis of that data. fundraising\ndevelopment in conjunction with the board, develops a comprehensive fundraising plan and secures financial support from individuals,\nfoundations, and corporations, develops and maintains ongoing relationships with major donors and grant funders, and oversees and\nparticipates in all fundraising and community awareness events.\nprivate contributions increased by 71% in fy 2015 over fy 2014.\nexecutive director\nseptember 2008 to april 2013 company name city , state\nresponsibilities related to writer/editor position marketing & publications\noversaw the development of communications, including web site content, e-mail and social media messages, and the quarterly newsletter oversaw and conducted event marketing served as managing editor for association publications, including oversight of volunteer and staff\nwriters and wrote policy papers, web content, news releases, and other documents as needed. community outreach and\nadvocacy\nbut were not limited to: the npa s recommendations were adopted by the national institutes of health (nih), the national science\nfoundation (nsf), and most recently, the white house office of science and technology policy. the npa garnered attention to the\ninternational consortium of research staff associations, led by the npa and representatives from the united kingdom, ireland, and south\nafrica. other major responsibilities leadership reported directly to and works with the board of directors to ensure the sustainability\nand growth of the 501(c)3 organization oversaw a staff of two full-time and one part-time persons. strategic planning worked\nfacilitator national science foundation, arlington, va, april 23-24, 2012. practical tips for effective mentoring: hand-holding not required and what do you need from your mentoring relationships environmental protection agency, raleigh, nc, january 3, 2012. comments on\nengineers, washington, dc, december 13, 2011. leading innovation and discovery workshop organizer and session facilitator national\nscience foundation, arlington, va, september 19, 2011. postdoctoral trends and perspectives: selection, training, and support, graduate\ncareer consortium, stanford university, stanford, ca, june 23, 2011. presentation regarding postdoc workforce issues national institutes of\nhealth (nih) biomedical research workforce working group (advisory committee to the nih director) co-presented with zoe fonseca-\nkelly, ph.d., chair, npa board of directors nih, bethesda, md, june 21, 2011. facilitating postdoc women s advancement in the academic\ncareer pipeline, oregon state university, corvalis, or, may 27, 2011. postdocs, federal initiatives and title ix, 2011 npa annual meeting,\nbethesda, md, march 26, 2011. postdocs & title ix (plus: some promising practices), 2010 nsf advance workshop, alexandria, va,\nnovember 8, 2010. postdoc women, national academies committee on women in science, engineering, and medicine (cwsem) meeting,\nwashington, dc, november 4, 2010. let s talk: broadening participation in the social, behavioral, and economic sciences postdoctoral\ncommunity workshop, national science foundation, arlington, va, organizer and session facilitator, october 29, 2010. epscor mentoring\nplan: the npa core competencies & idps, arkansas science & technology authority epscor annual meeting, little rock, ar, october 4,\n2010. remarks, national academies committee on research universities reception, washington, dc, september 21, 2010. feeling invisible :\ndivision of science resources statistics, july 13, 2010. thinking long-term: the keys to a successful postdoc, the university of south dakota,\nprovidence, r.i., february 25, 2010. what makes a successful postdoctoral program , cedars-sinai medical center, graduate program in",
      "companies": [
        "company",
        "corp",
        "inc"
      ],
      "titles": [
        "engineer",
        "intern"
      ],
      "years": [
        "20"
      ]
    },
    "EDUCATION": {
      "raw": "example, the fall 2014 newsletter, available at http://www.foothillscac.org/uploads/9/9/2/1/9921414/foothills-newsletter-fall-2014.pdf\nmaintains and updates web sites in coordination with a volunteer webmaster.\nensures that the overall message aligns with the vision, mission, and goals of the center. public awareness and community\nrelations\nmaintains and develops relationships with community organizations and agencies, governmental and funding bodies, the media, and others,\nserved as spokesperson for the college.\nestablished foundation and grant development, a new office at the college served as the college s main grant writer.\nserved as the president s chief writer. major responsibilities\noversaw external and internal communications, served as editor and chief writer and photographer for the alumni magazine, the\nmorningsider, and the e-newsletter, on the move.\noversaw all marketing efforts and marketing research, including leading an integrated marketing team and the development and production\nof television and radio commercials and print advertising. worked closely with admissions to develop and implement marketing\ncampaigns for recruiting students the college s enrollment increased by 57 percent from 2001 to 2006. led the marketing efforts for\nthe college s 2002-2008 capital campaign, including development and production of publications and the campaign video served as point\nperson for public launch event in october 2004 the campaign, which began with a goal of 20 million in 2002, raised 42 million by its\nconclusion. oversaw the redesign and ongoing maintenance of the college web site, including major redesigns in 2003 and direction of\na team of over 20 web editors thereafter.\nmanaged a staff of four to eight.\nassisted with special event planning as needed. major responsibilities included writing all news releases, copy for brochures, articles for the\nalumni magazine, and other writing as assigned.\nco-owner/manager\njanuary 1974 to january 1999 company name city , state\nmanaged the business and its facilities, serving as its accountant and overseeing customer service and marketing efforts. relevant\nproficiencies\nexperienced in conducting interviews in a sensitive, culturally aware manner.\nexperienced in communication through written materials.\nexperienced in presenting and teaching to large audiences (see\nb.a. : spanish , 1999 morningside college city , state , us b.a., english (with an emphasis in writing) and spanish, minor in mass\ncommunications, morningside college, sioux city, iowa, 1999\nm.a. : leadership bellevue university m.a., leadership, bellevue university, omaha, neb., january 2008\nlanguages\nan emphasis in writing) and spanish, minor in mass communications,\nprofessional affiliations\nworking with the board, maintains the shared vision of the organization and appropriate goals and strategies to achieve that mission, provides\nleadership in developing programs and organizational and financial plans, maintains acceptable standards of professional practice in the center, and\nensures ongoing accreditation by the national children s alliance\npublications\nto hear a child be a hero for kids and words hurt, too npa testimony regarding the status of women of color in stem. national\npostdoctoral association. available nih biomedical working group, not-od-. johnson phillips, c., fonseca-kelly, z., fowler, g., gelhaus,\ns., and taylor, d. . the future of science in the united states: the case for supporting the invisible researchers. johnson phillips, c. (2008) the advantages and challenges of at small, private colleges (master s thesis). omaha: bellevue university johnson phillips, c., gelhaus, s.,\nho, j., and pohlhaus, j.,\npresentations\nfoothills child advocacy center: helping child victims first presbyterian church spring gathering luncheon charlottesville, va march 21,\n2015 foothills child advocacy center: proposal for action leadership charlottesville, charlottesville, va, november 20, 2013 finding a\npostdoc to match your career goals city university of new york (cuny) career and research symposium, new york, ny, february 1,\n2013. panelist, society and association effort to foster research integrity national academies committee on responsible science: ensuring the\nintegrity of the research process, washington, dc, august 14, 2012. panel moderator, launch of international consortium of research staff\nassociations (icorsa), the european open science forum, dublin, ireland, july 13, 2012. using data to inform policy recommendations and\nstrategic planning association of institutional research (air)/nsf/national center for educational statistics (nces) national research data\n14, 2012. finding a postdoc to match your career goals howard university 2012 preparing future faculty (pff) summer institute,\nwashington, dc, june 8, 2012. expanding cross-disciplinary dialogue in the postdoctoral community workshop organizer and session\nbiomedical science and translational medicine, los angeles, calif., february 9, 2010 the npa core competencies, university of virginia\nlunchtime postdoc seminar, charlottesville, va., november 2009. what makes a successful training program the national institute on drug\nabuse (nida) research training directors meeting: sustaining training programs for the 21st century, bethesda, md., november 2009.\nannual meeting: innovation and optimization of graduate student and postdoctorate learning and development, st. louis, mo., october 2009.\nleadership styles and conflict management, npa committee leadership institute, bethesda, md., october 2009. the state of the\npostdoctoral researcher today, the cancer biology training consortium (cabtrac), cancer biology chair and directors retreat,\nclearwater beach, fla., october 2009 what every postdoctoral scholar should know, the howard university/university of texas at el paso\n(utep) annual institute of postdoctoral preparation, el paso, texas, september 2009. mentoring plans for postdoctoral associates, the\nnational science foundation (nsf) division of human resource development (hrd) 2009 joint annual meeting (jam), washington, d.c.,\njune 2009. what every postdoctoral scholar and principal investigator should know: the national postdoctoral association core\ncompetencies, the university of nebraska-lincoln research fair lincoln, neb., april 2009. general presentation on the npa and postdoctoral\nissues, postdoctoral and young investigator networking brunch, american society for nutrition (asn) scientific sessions at experimental\nva., january 28, 2009. leadership seminar leader, morningside college leadership academy, march 2008. cost-effective surveys, public\nquota international of sioux city annual eighth grade honors luncheon, march 2006 and march 2007.",
      "degree": [
        "doctorate",
        "master"
      ],
      "institution": [
        "college",
        "institute",
        "university"
      ],
      "years": [
        "19",
        "20"
      ]
    },
    "ACTIVITIES": "with the board of directors to develop the association s strategic plan and is responsible for the implementation of the plan most recently, a\nnew five-year plan was developed for 2013-2017. program management developed programs that benefit and support the\nassociation s diverse constituencies and leads staff and volunteers in implementing these programs, including but not limited to the\nlimited to fundraising campaigns, grant writing, and donor cultivation, and worked to build a culture of giving within the served community.\nfiscal management oversaw accounting according to generally accepted accounting principles (gaap) and in line with 501(c)3\nregulations including but not limited to the following: grant management payroll general ledger financial statements and development of\nannual budgets.\npublic relations staff writer\njanuary 1999 to august 2008 company name city , state\nposition chief writer, editor, and photographer\noversaw external and internal communications, served as editor and chief writer and photographer for news releases, the alumni magazine\nthe morningsider, and the e-newsletter, on the move. conducted interviews of alumni, faculty and staff on a regular basis.\nmarketing\noversaw all marketing efforts and marketing research, including leading an integrated marketing team and the development and production\nof television and radio commercials and print advertising. major responsibilities\nserved as the president s researcher and writer for the college s strategic plan.\noversaw office of foundation and grant development served as the college s main grant writer. successful fundraising included but was\nnot limited to: worked closely with faculty to develop and seek funding for new programming for example, worked with professors\nfrom the mathematical sciences department in developing programming and writing and submitting a proposal for the national science\nfoundation s s-stem solicitation the 600,000 proposal was funded in february 2009.\nserved on committees and task forces as assigned by the president. major responsibilities\nsupervised office of public relations and staff of five was responsible for ensuring continuation of consistent media coverage and effective\nmarketing efforts."
  }
}