{
  "id": "cv (2842).pdf",
  "normalized_sections": {
    "WORK EXPERIENCE": {
      "raw": "permanent address\nmahesh chandra s\ndoor no.: 2-13-3/5, anikethana near aganavadi centre, kannerthotta,\nmob: 91 8971477239 / 8056254639\npost kotekar, mangalore 575022\npersonal statement\nresult oriented manager with expertise in driving office administration and supply\nchain management. strong operational manager with strengths in ensuring high\nsatisfaction and result oriented. good time and / contracts management\nwith good communication and interpersonal abilities to a growing company in need of\ntop-level support.\nareas of proven performance\nhuman resource management\noffice administration planning & scheduling\ndocument controlling & book tendering & contracts management\nkeeping supply chain management\nasset management procurement / purchase\naccounts payable / receivables vendor coordination\ntally erp accounting software inventory management\ngst computation and filling stores management\ntds, excise documentation logistic & transport management\nms excel, word, outlook, powerpoint\nautocad, primavera p6, ms shree lakshmi traders , mangalore,\njune 2017 feb 2018\nkarnataka\nmanager marketing & sales\nconduct economic and commercial surveys to identify potential markets for products and services.\nformulate, direct and coordinate marketing and policies to promote products.\nidentify, develop, and evaluate marketing strategy, based on knowledge of establishment objectives, market characteristics, and cost and markup factors.\nupdating the invoices, expenditure in tally erp and updating the inward and outward of stocks. preparation of gst calculation and filling the returns.\nace innovative engineering services\nprivate limited\njan 2015 may 2017\ncertificate of participation job safety awareness - basics certificate of participation job technical basics life saver certificate basic life support life saver certificate basic fire safety and emergency preparedness personal details passport no.: z 3120198\nvalid up to: 09-03-2025 date of birth : 05-09-1968\nage 49 years sex male\nstatus married\nand correct. in case of any reference required it shall be presented.\nyours truly\nmahesh chandra someshwar",
      "companies": [
        "company"
      ],
      "titles": [
        "engineer",
        "manager"
      ],
      "years": [
        "19",
        "20"
      ]
    },
    "PROJECTS": {
      "raw": "chennai, tamil nadu, india\nmanager supply chain management\nanalyzing the production requirement and ensure the availability of raw materials for smooth operation.\nappraising vendor manufacturing ability through on-site visits, negotiate prices and terms with suppliers, vendor and freight forwarders. review of engineering\ndrawing for preparation of boq for product development.\nmonitor supplier performance. preparing of work order / purchase orders. preparing procedure / sop and maintaining iso documents. verifying the supplier invoice and clearing for payments. f & k ibrahim al shuwayer &\nnov 2008 dec 2014\npartners, kuwait\ntendering executive, 2009 - 2010\nadmin executive, 2008 2009\nrepeatedly promoted during tenure with f & k ibrahim al shuwayer & partners,\nmanagement and handled a team of 10 administrative professionals\nstarted my career with f & k as administrative executive, human resources handling hr planning, selection process, recruitment process,\npayroll process, compensation process, training & development,\nperformance appraisal etc., transportation and accommodation, ordering the requirement like\nstationary, assets purchase etc., preparing minutes of meeting accordingly.\nmanaging office budgets. liaising with staff, suppliers and clients. document controller - responsible for establishing and maintain an\nquantities\nreviewing the contract documents with actual work progress for the entire in the most profitable way. preparation of alteration drawings through autocad and submits for variation orders. agencies.\npromoted as tendering cum planning engineer, and, started my career hours, machine hours, resource loading in primavera p6, preparation of\nschedule, preparation of short term detailed schedule based on baseline\nschedule.\nmohtisham complexes private\nnov 2006 aug 2008\nlimited, mangalore\nassistant manager expenditure management section\na company with inspiration, robust engineering, in house research and\nbenchmark quality go into the making of any endeavor, creating masterpieces of\narchitectural elegance in the city of mangalore, india\ncoordinate and manage all administrative, contractual and operational aspects of the procurement division,\nprepare the purchasing budget for review by the department head. administer, control and coordinate budget and expenditures. approve\nrequisitions, field purchase orders, procurement card expenditures and\ncontracts. with information availability, technical requirements and financial\ncomplexity\ndeveloping of purchasing policies and procedures. formulate, obtain, and maintain policies and procedures for authorization by the management.\npreparation of purchase orders which are in conformance with the procurement code. producing written determination for procurement\ntransactions outside the fiduciary levels (i.e., emergencies) for approval by\nthe management.\nmeasure vendor performance. cancel contract, suspend or implement debarment proceedings on vendors not meeting performance requirements.\nplan and manage inventory levels of materials or products. monitor and co-ordinate deliveries of items between suppliers to ensure that all items are delivered to site/store on time.\ntrain, motivate, coach, develop, and evaluate assigned professional, technical, and clerical purchasing staff.\nestablish and maintain effective working relationships with other employees, public officials, and members of the general public.\nintegral component manufacturing responsible for equipment maintenance tasks such as managing and installing custom upgrades for customers replacing cables, components and\naccessories maintaining records and drawing schematics of the center to\ndetail what equipment is installed.\ncustomer support responsibilities might include escorting customers through the center on tours, responding to customer inquiries and coordinating with\nother organizations.\nadministrative duties might include scheduling employee shifts, planning for capacity changes, maintaining corporate databases and ensuring compliance\nwith government regulations.\nsree sasthaa agencies, salem, tamil\naug 1996 oct 1997\nnadu\nsales / administrative executive\nbrand and product promotion of lubricants to the automotive industries. approaching and suggesting and branding the lubricants for automobile clients, heavy machinery industry, textile industry.\npurchasing of base oils, additives, chemicals for production of lubricants preparation of purchase orders. planning and managing inventory levels. pentium computer academy, salem,\noct 1996 jun 1997\ntamil nadu\nfaculty (part time)\nhandling classes in operating systems (dos & windows)\no\nintro to computer\no\nmicrosoft office (ms word, ms excel, ms power point, ms access)\no\nsundaram clayton limited (tvs\ngroup)\nmay 1988 jan 1991\nrailway product division, hosur,\ntamil nadu\ndraftsman - mechanical\ndraft and prepare layout drawings for railway signaling. draft and prepare panel drawing for railway signaling system manually and using auto cad software. soild state interlocking system.\nacharya industrial training institute,\ndec 1987 may 1988\nbangalore\ncomputer competency\napplication software\nhonors diploma in software engineering niit, salem. advance diploma in software engineering technology in aptech - asset (adset-97).\nexpert in microsoft office (ms word, ms excel, ms power point, ms access). primavera p6. successfully completed 40 hrs. training in pmp course from silver management training institute, kuwait.\ndrawing & design software\nautocad management system (pdms aveva) from petrocon piping institute mangalore\nother certificates\ncertificate of attendance understanding of quality management system (iso 9001:2008)\ncertificate of participation behavioral aspects basics",
      "keywords": [
        "app",
        "system"
      ]
    },
    "ACTIVITIES": "effective document control system. ensure that all design documents are\naccurate, up to date and accurately distributed to relevant parties.\non an opportunity promoted as tendering executive, and, carrying the reviewing engineering drawings in autocad and preparation of bill of mar 2005 oct 2006\nprivate limited\noffice manager\nanalyzing the production requirement and ensure the availability of raw materials, planning of moving the semi-finished component to the out sourcing\nsupplier and vice versa.\ncoordinating with logistic executive for timely movement of component by road, air or ship.\nsource for new parts, suppliers or sub-contractors when the need arises. monitor and co-ordinate deliveries of items between suppliers (local and overseas),\nensure competent quality execution of all regular purchasing duties and administrative works, coordinate with suppliers to ensure on-time delivery,\nsource, select and negotiate for the best purchase package in terms of quality, price, terms, deliveries and services with suppliers, evaluating the supplier\nperformance as per iso standards,\nhandling office administration preparing of pay roll, employee statutory requirement esi, pf\no\no\nstatements, claiming of duty drawbacks.\npreparation of invoices (exports), documents related to exports, packing slip\no\nhotel moti mahal, mangalore,\noct 2004 feb 2005\nkarnataka\nsystem administrator services\nserve as the primary system administrator for window servers monitor system performance and utilization\no\nmaintain servers and system security\no\nmanage backup process and perform data recoveries as needed. ensure systems team supports on request, respond rapidly to system maintenance needs.\nmanaging data base administration developed in foxpro 2.6 and assisting software development team on improving the process.\nbharath roadways, salem, tamil\njan 1991 aug 1996\nnadu\nmay 2002 oct 2004\noffice manager",
    "EDUCATION": {
      "raw": "manages the supply of logistics-related data to support customers in the day- to-day requirements.\nconsults with assigned clients to understand their distribution networks and determines the logistics resources required to support equipment, safety,\npersonnel and maintenance. negotiates with supply sources to meet technical\nrequirements.\nensure that partners understand and accept customer guidelines and requirements for all logistics operations, including service and repair.\ntrack, analyze and communicate key performance metrics. partners with key cross-functional partners to solicit customer and associate feedback to identify program improvement opportunities for implementation.\nascertain industry/logistics best practices to identify new and/or unique programs to differentiate customer from the marketplace and drive customer\nsatisfaction.\nresponsible for internal communications and presentations. wintech informatics, salem, tamil\noct 1997 apr 2002\nnadu\nhead center-in-charge the students for learning in the institute.\ntrainer / instructor\nassigned as an trainer / instructor for handling engineering drawing and work shop calculation classes for draftsman (engineering drawing) students.\nmaster program of business administration (master of business administration) from janhimalay eduction s indian school of management & studies july 2013 - october 2014 (distance\nbachelor of business administration ( management) from granttown university, usa april 2014 (distance )\nnational apprenticeship certificate in sundaram clayton ltd., draftsman mechanical 1989\nnational trade certificate ministry of labour from acharya industrial training institute, bangalore",
      "degree": [
        "bachelor",
        "master"
      ],
      "institution": [
        "institute",
        "school",
        "university"
      ],
      "years": [
        "19",
        "20"
      ]
    }
  }
}